id,name,text,trans
0-chapter_name,,5th bout,第五回合
0-synopsis,,アルハリードに負けたシスは、掴んだ情報を姬塔へと伝える。そしてビィはその情報をカタリナ達と共有するために飛んでいき、ルリアはこの後の試合をジェシカと共に観戦することになる。武闘大会開催前、シェロカルテは、武闘大会におけるアルハリードの真の目的に気が付いたために、アルハリードと対立していたようだった。,败给阿尔哈列德的希斯，将他所掌握的情报告诉了姬塔。碧将此事告知卡塔莉娜等人，而露莉亚则和杰西卡一起观看接下来的比赛。武道大会举办前，榭洛科特似乎因为察觉到了阿尔哈列德在武道大会上的真正目的而与之对峙。
2,シス/希斯,…………,……
3,,７回戦の決着後、リングの裏にいた\n姬塔のところへ\nシスが近づいてくる。,第七回合结束后，希斯靠近了在擂台后的姬塔。
4,シス/希斯,……あいつの力にはからくりがある。,……那家伙的力量有蹊跷。
5,,辺りにちらりと意識を配った後、\nシスは姬塔にだけ届く声で\n囁く。,环顾了一下四周后，希斯用只有姬塔才能听到的声音低语道。
6,シス/希斯,首の裏だ。,是后颈。
8,,戸惑いながらも、\n姬塔は小さく頷き返した。,姬塔虽然困惑，但还是轻轻地点了点头。
9,シス/希斯,だがおそらく、\nあいつの最も大きな力は印象操作。,但或许，那家伙最大的力量是印象操作。
10,シス/希斯,暴くにせよ、利用されるにせよ\n勝負はリングの上だ。,无论是揭穿还是被利用，胜负都要在擂台上见分晓。
11,シス/希斯,気をつけろ、姬塔。,小心点，姬塔。
18,ルリア/露莉亚,印象操作……？,印象操作……？
19,ビィ/碧,オイラにも全部はわかってねぇけど、\nとにかく、リングの上で戦って\nどうにかするしかねぇってことか。,我虽然也不清楚，但总之，只能在擂台上战斗想办法解决了吧。
20,,急ぎ観客席に戻った姬塔は、\nビィとルリアにシスの言葉を伝える。,姬塔急忙回到观众席，将希斯的话告诉了碧和露莉亚。
21,ビィ/碧,それはお前に任せるしかねぇな。\n後は……,那只能交给你了。然后是……
22,ルリア/露莉亚,カタリナ達にも伝えた方が\nいいんじゃないでしょうか？,是不是应该告诉卡塔莉娜小姐她们？
23,ビィ/碧,そうだな！\nオイラが急いで飛んでって\n伝えてくるぜ！,说的也是！我这就赶紧飞去告诉她们！
24,ルリア/露莉亚,ビィさん、\nありがとうございます！,碧先生，谢谢您！
25,ビィ/碧,……いや、待てよ？\nそうするとルリアが\n一人になっちまう。,……不对，等等？那露莉亚就一个人了。
26,ビィ/碧,姬塔も、もう控室に\n行かねぇとまずいもんな。,姬塔你现在也该去准备室了。
27,ルリア/露莉亚,えっと、あの、私……,那个，我……
29,ジェシカ/杰西卡,あら？\nルリアちゃんにビィさん。,哎呀？这不是露莉亚和碧先生吗？
30,ルリア/露莉亚,あ、ジェシカさん！,啊，杰西卡小姐！
31,ビィ/碧,あれ？\nアイルの奴は一緒じゃねぇのか？,咦？那家伙没和你在一起吗？
32,ジェシカ/杰西卡,ああ、今はちょっと……,啊，他现在有点……
33,,ジェシカは困ったように笑う。,杰西卡面露难色地笑了笑。
34,ジェシカ/杰西卡,負けた後だから、きっと一人に\nなりたいと思って。,因为输了比赛，所以他现在应该想一个人静一静吧。
35,ビィ/碧,ああ、\n落ち込んでるかもしれねぇからなぁ。,啊，他可能正沮丧呢。
36,ジェシカ/杰西卡,それもですけど、\n一人で色々と\n考えたいんじゃないかなって。,虽然是那样，但我认为他应该是想一个人好好想想。
37,ジェシカ/杰西卡,で、そんなわけなので、\n良かったら一緒にこの後の試合を\n見ないかなって思ったんですけど……,所以，我想着要不要一起看接下来的比赛……
38,ビィ/碧,おお！\nやったなルリア！\nこれで安心だぜ！,哦！太好了，露莉亚！这样我就放心了！
39,ジェシカ/杰西卡,安心？,放心？
40,ルリア/露莉亚,あ、あの……\nビィさんがちょっと用事があって、\n私が一人になっちゃうので……,啊，那个……碧先生有点事，我就要一个人了……
41,ビィ/碧,そうなんだ！\n姬塔も今は、その、\nいねぇから心配でよぉ！,是啊！姬塔现在也不在，我很担心啊！
42,ジェシカ/杰西卡,あら、そうなんですか？,哎呀，是这样吗？
44,,ジェシカは、マスクを被ったままの\n姬塔をちらりと見て微笑む。,杰西卡瞥了一眼戴着面具的姬塔，微笑着说道。
45,ジェシカ/杰西卡,それなら、ルリアちゃんは\n私が責任を持ってお預かりしますね。,那我就来照顾露莉亚吧。
46,ビィ/碧,助かったぜ！\n頼むな、ジェシカ！,帮大忙了！拜托你了，杰西卡！
47,,こうしてルリアをジェシカに任せ、\nビィはカタリナ達のもとへ、\n姬塔は控室に急ぎ向かう。,就这样，露莉亚被托付给了杰西卡，碧去找卡塔莉娜等人，而姬塔则急忙赶往准备室。
56,シェロカルテ/榭洛科特,なるほど～\nあなたの目的、\nそういうことだったんですね～,原来如此～你的目的～就是这个啊～
57,アルハリード,……まさか、気づかれるとは\n思っていませんでしたよ。,……没想到，竟然被你察觉到了。
58,シェロカルテ/榭洛科特,予想していたのとは\nかなり違いましたけどね～,虽然和我想象的\n有些出入～
59,シェロカルテ/榭洛科特,もっとこう……\nファータ・グランデ征服とか、\n経済界の掌握とか、そういうことかと～,我还以为是……\n征服法塔·格兰德，\n掌控经济命脉之类的～
60,アルハリード,ははは。\n随分と買いかぶられていたようだ。,哈哈哈。\n你太高估我了。
61,シェロカルテ/榭洛科特,いえいえ～\nあなたがその気になれば、\nできるんじゃないですかね～？,不不不～\n只要你愿意，\n肯定能做到的吧～？
62,アルハリード,そうだとしても、\nどうせ、あなたにこうして\n邪魔されていたのでは？,就算如此，\n也会被你这样\n妨碍吧？
63,アルハリード,そんなことより……それで？\n私の目的を知って、\nあなたはどうしますか？,比起这个……你打算怎么办？\n知道了我的目的，\n你打算怎么做？
64,シェロカルテ/榭洛科特,そうですね～\nやっぱり、賛成はできかねます～,怎么说呢～\n我还是不能赞成～
65,アルハリード,……そうですか。\nもしかしたら、と思ったんですがね。\n同じハーヴィンであるあなたなら、と。,……是吗。\n我还以为你会答应呢。\n因为你我都是星晶兽。
66,シェロカルテ/榭洛科特,まったく理解できない、とまで\n言うつもりはありませんが～……,我虽然不至于\n完全无法理解～……
67,シェロカルテ/榭洛科特,それは、\nただのないものねだりだと\n思いますよ～,但我认为\n那只是痴心妄想～
68,アルハリード,なんとでも言ってください。\nとにかく……,你说什么都好。\n总之……
73,アルハリード,あなたに邪魔をされるわけには\nいかない。申し訳ありませんが、\n大人しくしてもらいます。,我不能让你妨碍我。\n抱歉，\n你就在此乖乖就擒吧。
info,,,scene_evt180430_cp5_q3_s10
译者,,,Gemini
