id,name,text,trans
0-chapter_name,,第2話 二人のお姉ちゃん,两位姐姐
0-synopsis,,ソシエが森へ入ろうとすると、少年が立ちはだかる。ソシエは、少年が畑の野菜が腐っているのを知っており、村人に食べてほしくないから踏んだと指摘する。また、野菜が腐ったのは森にある何かが原因で、少年はその何かから人を遠ざけようとしていたと推察する。ユエルは少年の意図こそ理解するが、方法が乱暴だと叱る。コウと名乗る少年の誤解を解くため、ユエルとソシエは共に村人に謝りに行くのだった。,苏西耶正要走进森林，一个少年挡在了她的面前。苏西耶指出，少年知道田里的蔬菜已经腐烂，所以才踩坏它们，是不想让村民吃掉。她还推测，蔬菜腐烂是由于森林里的某种东西造成的，而少年是想把人们从那种东西身边赶走。尤艾尔虽然理解少年的意图，但还是斥责了他的粗暴行为。为了解开名叫蔻的少年的误会，尤艾尔和苏西耶决定一起去向村民道歉。
1,ソシエ/苏丝雅,えっとね、見てて。,那个，看着我。
2,,ソシエはそう告げると、少年が\n消えて行った森へ歩みを進める。,苏西耶说完，便朝着少年消失的森林走去。
6,,すると、すかさず、\n刀を抜いた少年がソシエの前に\n立ちふさがるようにして現れる。,就在这时，拔出刀的少年出现在苏西耶面前，挡住了她的去路。
7,？？？,なんですか、また。\nしつこい人たちだな。,你们干什么，又来。真是阴魂不散。
8,ユエル/尤艾尔,ソ、ソシエッ！\n無事っ！？,苏、苏西耶！你没事吧！？
9,ソシエ/苏丝雅,うん、大丈夫。\nふふふ、やっぱりだ。,嗯，没事。\n呵呵呵，果然如此。
10,ソシエ/苏丝雅,僕、とっても優しい子なんだね。,你真是个温柔的孩子呢。
11,？？？,え？,诶？
12,？？？,はぁ！？,哈！？
13,ユエル/尤艾尔,や、優しいぃ～！？\nこのちんちくりんが！？,你、你说温柔～！？\n就这小矮子！？
14,ビィ/碧,そいつは人も襲ってるし、\n村の大切な畑も荒らしてるし、\n今もお前に刀を向けてるんだぞ！？,那家伙袭击人，\n还破坏村里重要的田地，\n现在还拿刀指着你！？
15,ソシエ/苏丝雅,う、うん……けど、\nちゃんと全部、意味があるんだよ。,嗯、嗯……但是，\n这一切都是有意义的。
16,ソシエ/苏丝雅,ほら、見て。,你看。
17,,ソシエはそういうと、\n荒らされた畑にあった\n野菜の残骸を取り出す。,苏西耶说着，\n从被毁坏的田地里\n拿出蔬菜的残渣。
18,ユエル/尤艾尔,はぁ、もったいない。\nこないなってもうたら、\nフートン焼きにできへんやん。,唉，太可惜了。\n变成这样的话，\n就不能做大阪烧了。
19,ユエル/尤艾尔,身もグズグズやんか！\nああ、可哀想に……,都烂掉了！\n啊，真可怜……
20,ユエル/尤艾尔,うん？　グズグズ？,嗯？烂掉了？
21,ルリア/露莉亚,そのお野菜、腐ってませんか？,那些蔬菜，是不是腐烂了？
22,ソシエ/苏丝雅,そう。腐ってるんだよ。\nこれだけじゃなくて、\n畑にあるお野菜、全部。,对。腐烂了。\n不只是这些，\n田里的蔬菜，全都烂了。
23,ソシエ/苏丝雅,きっと、このお野菜を\nみんなに食べてほしくなくて、\n畑を荒らしてたんだよね……？,你一定是\n不想让大家吃这些蔬菜，\n所以才毁坏田地的吧……？
24,？？？,ッ！！,！
25,ソシエ/苏丝雅,それに今だって、\n私を何かから護ろうとしてた。\n違う、かな？,而且你现在，\n也是在保护我免受什么东西的伤害。\n我没有说错吧？
26,？？？,べ、別に。,才、才没有。
27,ソシエ/苏丝雅,この森にはたぶん、\n何か危ないものがあるんだと思う。,这片森林里或许\n有某种危险的东西。
28,ソシエ/苏丝雅,お野菜をこんな風に\n腐らせちゃうほど\n危険な何かが……,能把蔬菜变成这样\n的危险的东西……
29,ソシエ/苏丝雅,それを知らない人が近づいちゃって、\n危険な目に遭わないように、\n前もって追い払ってたんだよね。,你是为了不让不知道的人靠近，\n遭遇危险，\n所以才事先把他们赶走的吧。
30,？？？,それは、その……,那、那个……
31,ソシエ/苏丝雅,ふふふ、その反応だと、\nやっぱりそうみたいだね。,呵呵呵，从你的反应来看，\n果然是这样呢。
32,ソシエ/苏丝雅,それに私はずっと、\nなんとなくだけど……,而且我一直，\n虽然只是直觉……
33,ソシエ/苏丝雅,君はいい子だって、\n思ってたから……！,觉得你是个好孩子……！
34,,心なしかどこか\n胸を張って告げるソシエ。,苏西耶挺起胸膛说道。
35,ユエル/尤艾尔,ソシエらしい理屈やなぁ。\nなんちゅうか、アンタ、\n不器用なやっちゃなぁ。,真是符合苏西耶的逻辑呢。\n怎么说呢，你啊，\n真是个不坦率的家伙呢。
36,？？？,う、五月蠅いですよ。,吵、吵死了。
37,ユエル/尤艾尔,ま、なんにせよ、や。\nどんな理由があろうと、\nこれじゃアカンって。,嘛，不管怎么说。\n不管有什么理由，\n都不能这样做。
38,ユエル/尤艾尔,やり方があるやろ！\nこんなことしたらアカンて。,应该有其他办法吧！\n不能做这种事。
39,ユエル/尤艾尔,村の人に迷惑かけるし、\nソシエにひどいこと言うし、\nちゃんと謝らなアカンよ。,你给村民添麻烦了，\n还对苏西耶说了过分的话，\n必须好好道歉。
40,？？？,悪かったですね。\nこれでいいですか？,抱歉了。\n这样可以了吗？
41,ビィ/碧,ひねくれてやがるなぁ！\n可愛げがまったくねぇ。,真是别扭！\n一点都不可爱。
42,ユエル/尤艾尔,まぁ、ええやろ。,嘛，算了。
43,ユエル/尤艾尔,ただ覚えとき。悪いことしたり、\n誰かを傷つけてしもたら、\n謝らなアカン。当たり前のことや。,给我记住。做了坏事，\n或者伤害了别人，\n就要道歉。这是理所当然的事。
44,ユエル/尤艾尔,ちゅうことで！\n次は村の人に謝りいこな！,所以！\n接下来去给村民道歉吧！
45,？？？,ええっ！？,诶！？
46,ユエル/尤艾尔,アンタにはぎょうさん\n聞きたいことがあんねんけど、\n今はおいとくで。,我有很多事想问你，\n不过现在先等等。
47,ソシエ/苏丝雅,一緒に行こう？\n私も謝ってあげるから……,一起走吧？\n我也会道歉的……
48,ビィ/碧,いやいや、ソシエは\n一緒に謝る必要ないんじゃねぇか？,不不不，苏西耶\n没必要一起道歉吧？
49,ソシエ/苏丝雅,あ、そか。\nでも、誤解を解くんは、\n手伝ってあげたいな。,啊，也是。\n但是，我想帮你\n解开误会。
50,ユエル/尤艾尔,ソシエはほんまに優しいなぁ。\n感謝しぃや？　えーと……,苏西耶真是温柔啊。\n该说谢谢吧？　那个……
51,ユエル/尤艾尔,アンタ、名前は？,你叫什么名字？
52,コウ/蔻,コウ、です。,我叫蔻。
53,ユエル/尤艾尔,コウ！　ええ名前やん。,蔻！好名字啊。
54,ユエル/尤艾尔,ほな、行くで！\n姉ちゃんたちについてきー！,那，走吧！\n跟上姐姐们！
55,,コウは困惑した様子を見せたが、\nユエルとソシエの後についていく。,蔻虽然面露难色，\n但还是跟在了尤艾尔和苏西耶身后。
info,,,scene_evt171031_cp2_q1_s10
译者,,,Gemini
