id,name,text,trans
0-chapter_name,,第1話 幻の珍味,第1话 幻之珍味
0-synopsis,,露店の店主は姬塔達を食い逃げ犯として憲兵に捕まえさせ、牢屋に入れられた一行は高額の保釈金を要求される。そこへ、オイゲンが連絡を取っていた探査工船の船長・サンザが現れ、保釈金を肩代わりしてくれる。代償として姬塔達はサンザと契約を交わし、探査工船へ乗り込むことになるのだった。,露店的店主将姬塔一行当作吃霸王餐的犯人交给宪兵抓起来，姬塔一行被关进牢房并被要求支付高额保释金。这时，欧根联系的探测工船船长桑扎出现，替他们支付了保释金。作为代价，姬塔一行与桑扎签订了合同，登上了探测工船。
0,オイゲン/欧根,ったく、あこぎな手で\n金巻き上げようとしやがって、\nしょうもねぇなぁオイ。,真是的，竟然用这种卑鄙手段来敲诈钱，真是无聊啊。
1,イッパツ,困った人達ですねぇ。\n大将の爪の垢を\n飲ませてやりたいすよ。,真是麻烦的人啊。真想让他们尝尝大将的厉害。
2,露店のお爺さん,ヒッ……\nなんちゅう強さだ……！,哎……好强啊……！
3,ジン/仁,代金はきちんと\n払わせて貰うとしよう。\n適正な料金を、な。,我们会好好支付费用的。正确的价钱。
4,,姬塔達が\n料金の交渉を始めようとした時、\n露店の店主が声を上げた。,姬塔一行正准备开始协商费用时，露店的店主大声喊了出来。
5,露店のお爺さん,助けでけろぉ～！\n食い逃げだぁ～！！,救命啊～！吃霸王餐啦～！！
6,,その言葉に、探査工船の\n拠点を守る憲兵達が\n集まってくる。,听到这话，守护探测工船据点的宪兵们聚集了过来。
7,ソリッズ/索利茲,ゲッ！？,哎！？
9,,逆らう訳にもいかず\n憲兵達に従った姬塔一行は\n申し開きも許されず牢に入れられた。,无奈之下，姬塔一行听从宪兵的命令，甚至没有机会辩解就被关进了牢房。
11,ジン/仁,こちらの話を\n聞いて貰えんとは……\n一体どうなっているんだ？,竟然不听我们的解释……这到底是怎么回事？
14,気弱な憲兵,あんたら、バカなことしたねぇ……,你们干了件蠢事啊……
15,ビィ/碧,おっさん、ここから出してくれよ！\n先に手を出してきたのは\nあっちなんだぜ！？,大叔，让我们出去！先动手的是他们啊！？
16,気弱な憲兵,はぁ……そんなことだろうと思ったよ。\nでもね、俺の一存じゃあ\n出してあげられんのだよ。,唉……我就知道会是这样的事。不过呢，我一个人做不了主让你们出去。
17,オイゲン/欧根,……どういうこった？ ,……这是怎么回事？
18,気弱な憲兵,あの店、ヤバい連中の肝いりでさ。\n俺達憲兵の中にも繋がってる奴がいて、\nしょっ引けんのよ。,那家店有些不妙的人在背后撑腰。我们宪兵中也有和他们勾结的人，没法随便动。
19,ジン/仁,なっ……！\nそれでも街の安全を守る\n憲兵か！？,什么……！即便如此，你们还是守护城市安全的宪兵吗！？
20,気弱な憲兵,突っつかなきゃ何もしないからなぁ……\n悪いこた言わねぇから、\nまぁ釈放まで大人しくしてなよ。,只要不去碰他们就不会有什么事……我也不说什么坏话，你们就安静待到被释放吧。
22,ランスロット/兰斯洛特,くっ……\nお前達、公僕としての\n誇りはないのか！！,可恶……你们身为公仆，就没有一点自豪感吗！！
24,柄の悪い憲兵,おいコラ！\n何くっちゃべってる！,喂喂！你们在嘀咕什么！
25,気弱な憲兵,ヒッ！\nな、なんでもありませんや！,哎！没、没什么！
26,柄の悪い憲兵,だったら表出てろ！\n……おい、お前ら。\n牢から出たいんだったら保釈金払いな。,那就出去吧！……喂，你们。如果想从牢里出去，就交保释金。
27,オイゲン/欧根,保釈金だと……？,保释金……？
28,柄の悪い憲兵,あぁ、そうだ。\n店と俺達への迷惑料だよ！\nそれでチャラにしてやる。,是啊，就是这样。是店和我们受到的麻烦费！这样就一笔勾销。
29,ビィ/碧,くっそぉ、好き勝手言いやがって！,可恶，说得真随便！
30,ジン/仁,しかし、穏便に済ませられるのなら\nその方がいいかもしれん。,不过，如果能和平解决的话，那也许是最好的。
31,ジン/仁,幾ら我々でも\n憲兵にケガ人を出さず\nここを抜けることは難しかろう。,即便是我们，不让宪兵受伤而从这里逃出去也是很难的。
32,ヴェイン/维恩,そうだな……さっきのおっさんみたいに\n悪い奴ってほどじゃない人も\nいるんだもんな……,确实如此……像刚才那位老爷爷那样的人，也不算是坏人……
34,オイゲン/欧根,……それで？\n保釈金ってのは、いくらなんだ？,……那么？保释金到底是多少？
35,柄の悪い憲兵,ほぉ、物わかりがいいじゃねぇか。\nほら、こんくらいだよ。,哟，挺懂事的嘛。给，看这个数。
36,,姬塔に手渡された紙を、\nビィとルリアが覗きこむ。,姬塔接过的纸，被碧和露莉亚凑过去看。
37,ルリア/露莉亚,えっと、ゼロが……\nひぃ、ふぅ、み……,这个，零有……一、二、三……
38,ビィ/碧,ふざけんな！\nこんなん払えるわけねぇだろ！？,开什么玩笑！这种钱怎么可能付得起！？
39,柄の悪い憲兵,へっ、だったら一生\nそこで燻ってるんだな。,哼，那就一辈子在那儿发霉吧。
40,ビィ/碧,ぐぬぬ……,哼……
42,？？？,金がねぇってんなら\n稼げばいいだろが。,说没钱的话，就去赚就是了。
43,ビィ/碧,ん……？\nジイさん、何者だぁ？,嗯……？老先生，你是谁？
44,？？？,何者だ、たぁ随分じゃねぇか……\nあんたらが探査工船に乗せろって\n話ぃ持ってきたんだろうが。,说是谁，真是太过分了……你们不是说要登上探测工船吗？
45,オイゲン/欧根,ってことは、あんたが\n探査工船の船長のサンザか！,这么说，你就是探测工船的船长桑扎！
46,サンザ,あぁ、そうだよ。\nお前さんが連絡のあったオイゲンか。\nったく、まさか捕まってるとはな……,是的，那就是你联系我的欧根。真是的，没想到会被抓住……
47,ジン/仁,面目ない……\n話も聞いて貰えず、\n致し方なく。,抱歉……连解释都没能听，真是无奈。
48,サンザ,ケヒッ、郷に入れば郷に従えだ。\n諦めて保釈金を払うんだな。,嘿，入乡随俗。放弃吧，付保释金。
49,サンザ,だがまぁ、払う当てがないんじゃ\nそこから出れもしねぇか……\n仕方ねぇ、ここは俺が払ってやる。,不过没办法支付的话，也出不去……没办法，这次我来替你们付。
50,ソリッズ/索利茲,いいのか！？\n有り難ェ！,真的可以吗！？太感谢了！
51,サンザ,ケヒッ、まぁ何かの縁だ。\nもともと、探査工船に乗ったら\n仕事を手伝ってもらう予定だったしな。,嘿，算是某种缘分。本来就打算让你们上船后帮忙工作的。
52,サンザ,給料の先払いだ……\nきっちり働いてもらうぜ。\nほら、契約書だ。,这是预付工资……要好好工作哦。来，合同书。
53,,姬塔は手渡された\n契約書にサインをすべく\n文面に目を通す。,姬塔准备在递过来的合同书上签字，浏览了一下内容。
54,ビィ/碧,未経験者歓迎……\n若い人が活躍してます、\nやる気を重視する職場です……,欢迎无经验者……年轻人活跃……看重干劲的工作场所……
55,ソリッズ/索利茲,ノルマはなしだが\n能力によって昇給あり、ねｪ。,没有任务定额，但根据能力可以加薪，嗯。
56,ソリッズ/索利茲,……おっ！？\nすげェな、給料こンなに出すのかよ。\n儲かってンだなぁ。,……哦！？真厉害，竟然给这么高的工资。看来赚了不少啊。
57,サンザ,ケヒッ……まぁな。\n怖い連中に買い叩かれるが、\nそれでも相当な銭が入るからよ。,嘿……是啊。虽然被可怕的人压价，但还是能赚到不少钱。
58,ビィ/碧,これ読む限り、\n条件は悪くなさそうだな！,从这上面看，条件似乎不错！
59,ルリア/露莉亚,ほっ……ひとまず、\nなんとかなりそうですね。,呼……总之，好像能解决了。
60,オイゲン/欧根,そうだな。\nまぁ、ちょいと変わった依頼を\n受けたと思えばいいか。,是啊。就当是接受了一个有点特别的委托吧。
61,,姬塔は、サンザに渡された\n契約書にサインをした。,姬塔在桑扎递来的合同书上签了字。
62,柄の悪い憲兵,話がまとまったんならとっとと出な！\nこっちは暇じゃないんだ、\n二度と来るんじゃねぇぞ！,事情解决的话就快滚出去！我们可没空，再也别来了！
63,ソリッズ/索利茲,へっ！\n頼まれたって二度と来るもンかよ！,哼！就算求我也不会再来了！
info,,,scene_evt160131_cp1_q3_s10
译者,,,gpt-4o-2024-08-06