id,name,text,trans
0-chapter_name,,南の守護神,南方守护神
0-synopsis,,年末のある日、「鳴弦の儀」を執り行うサンチラを手伝うため、姬塔達は午神宮に来ていた。一行に見守られる中、立派に儀式を執り行うサンチラだったが、その後、現代の知識が不足していることからトラブルが続く。このままではいけないと思ったサンチラは、今の世界を学ぶため、姬塔達の旅路に加わるのだった。,年末某日，为了帮助桑琪拉举行「鸣弦之仪」，姬塔一行来到了午神宫。桑琪拉在众人的注视下出色地完成了仪式，但之后却因缺乏现代知识而接连闹出乱子。意识到不能再这样下去的桑琪拉，为了了解当今世界，加入了姬塔一行的旅途。
1,,十二神将と姬塔によって\nサンチラは108年の眠りから目覚め、\n再び歳神のお役目を引き継いだ。,在十二神将与姬塔的帮助下，\n桑琪拉从长达108年的沉睡中苏醒，\n再次接过了岁神的职责。
7,,そして今日、姬塔達は\n彼女が執り行う『鳴弦の儀』を\n手伝うため、午神宮を訪れていた。,而今天，为了协助她举行\n『鸣弦之仪』，姬塔一行\n来到了午神宫。
11,サンチラ/桑琪拉,皆様、本日はご足労いただき、\n誠にありがとうございます。,各位，今日劳烦大家远道而来，\n实在感激不尽。
12,ビィ/碧,よう、サンチラ！\nすっげえ人の数だな！\n前やった時より増えてんじゃねぇか？,哟，桑琪拉！\n人可真多啊！\n是不是比上次举行时更多了？
13,サンチラ/桑琪拉,ええ、日を追うごとに。\n姬塔様方や十二神将の皆様が\n広く周知してくださったおかげです。,是的，一天比一天多。\n这都多亏姬塔大人一行\n和各位十二神将广为宣传。
14,くろっこ/黑子,ただ、総空神宮から派遣された社務は\n最低限しかいないから、\n現状、人手不足が甚だしいんだよね～,不过，总空神宫派来的神职人员\n只有最低限度的人数，\n所以现在人手严重不足呢～
15,しろっこ/白子,サンチラはこの前目が覚めたってのに、\n総空神宮ってけちんぼだね、けちんぼ！,桑琪拉才刚醒不久，\n总空神宫可真小气，小气鬼！
16,サンチラ/桑琪拉,こら、ふたりとも！　\n先の大浮上の影響で忙しい中、\n人手を頂けるだけありがたいのですよ。,你们两个，不许这么说！\n大浮升之后大家都忙得不可开交，\n还能分出人手给我们就该感激了。
17,サンチラ/桑琪拉,ただ、結局姬塔様方に\nご助力をお願いすることになったのは\n申し訳ない限りなのですが……,只是到头来还得请姬塔大人一行\n出手相助，实在令我过意不去……
18,ルリア/露莉亚,全然大丈夫です！\nむしろ、もっと私達を\n頼ってくれてもいいんですよ！,完全没关系！\n不如说，桑琪拉可以再多依靠我们一点哦！
19,サンチラ/桑琪拉,ルリアお姉様、ありがとうございます。\nそう言っていただけると、\nとても心強いですわ。,谢谢您，露莉亚姐姐。\n听您这么说，\n我心里踏实多了。
24,くろっこ/黑子,サンチラ、そろそろ行かないと。\nもうすぐ『鳴弦の儀』の時間だよ。,桑琪拉，差不多该过去了。\n『鸣弦之仪』马上就要开始了。
25,サンチラ/桑琪拉,それでは皆様、改めて本日は\nどうぞよろしくお願いいたします。,那么各位，今天还请大家\n多多关照。
30,,そう言って上品に頭を下げ、\nサンチラは鳴弦の儀を執り行うため、\n本殿へと向かっていくが──,桑琪拉说罢优雅地低头致意，\n随后为举行鸣弦之仪\n向正殿走去，然而──
31,しろっこ/白子,サンチラ！\n弓はここだよ！\n手に持ってるのは木の枝！,桑琪拉！\n弓在这里！\n你手里拿的是树枝！
32,サンチラ/桑琪拉,<span class='scene-font-4'>ええ！？</span>\nあ、ありがとう、しろっこ……,<span class='scene-font-4'>诶！？</span>\n谢、谢谢你，白子……
33,ルリア/露莉亚,あはは……\nサンチラちゃん、\n緊張してるのかも……？,啊哈哈……\n桑琪拉可能是有些紧张吧……？
34,ビィ/碧,そうかもしれねぇな……\nオイラ達も近くにいてやろうぜ、\n姬塔！,或许吧……\n我们也陪在她附近吧，姬塔！
40,,大勢の参拝客に見守られながら、\nサンチラは弦を弾き、\nその音は境内に響く。,在众多参拜者的注视下，\n桑琪拉拨动弓弦，\n弦音响彻境内。
47,,姬塔達の心配とは裏腹に\nサンチラは『鳴弦の儀』を\nつつがなく執り行うのだった。,与姬塔一行的担忧相反，\n桑琪拉顺利无事地\n完成了『鸣弦之仪』。
52,ルリア/露莉亚,サンチラちゃん、\nすっごくかっこよかったです！,桑琪拉，\n刚才真的特别帅气！
53,ビィ/碧,緊張してねぇか\n心配だったけど、\nすげぇ立派だったぜ！,我还担心你会不会紧张，\n不过你表现得真出色！
54,くろっこ/黑子,まぁ、当然だね！\n練習も欠かさず頑張ってたんだから！,哎呀，那当然！\n她可是一直都没落下练习！
60,しろっこ/白子,では、御朱印をお求めの皆様は\nこちらにお越しくださ～い！,那么，需要御朱印的各位，\n请到这边来～！
64,ルリア/露莉亚,わぁ……しろっこさんに連れられて、\n沢山の人がサンチラちゃんの前に\n並びはじめました！,哇……大家被白子带着，\n开始在桑琪拉面前排起长队了！
65,ビィ/碧,すげぇ人だな。\nあれみんな、御朱印目的か？,人可真多啊。\n他们全都是来求御朱印的吗？
66,くろっこ/黑子,そうだよ！　\nサンチラは字が綺麗だから、\n御朱印はとっても評判いいし……,是呀！桑琪拉的字很漂亮，\n所以她写的御朱印特别受欢迎……
67,くろっこ/黑子,この機会に\nサンチラとお話ししたいって人も\n多いんだよね！,而且还有很多人\n想趁这个机会和桑琪拉聊聊天呢！
68,ルリア/露莉亚,はわわ……あんなに大勢の人と\nお話しをしながら御朱印を書くなんて、\nサンチラちゃん、頑張り屋さんです……,哇哇……一边和这么多人交谈，\n一边写御朱印，\n桑琪拉真的好努力……
69,ビィ/碧,じゃ、眺めてるだけにはいかねぇな！\nオイラ達も手伝いに行こうぜ！,那我们可不能光看着！\n也去帮忙吧！
77,父親/父亲,私には15歳の娘がいるのですが、\n将来、あの子が幸せになれるのか、\n今から心配でたまらないんです。,我有一个15岁的女儿，\n一想到她将来能不能幸福，\n现在就担心得不得了。
78,サンチラ/桑琪拉,15歳……ですか。\n心配になるあなたのお気持ち、\nよくわかりますわ。,15岁……吗。\n您会为她担心的心情，\n我非常理解。
79,サンチラ/桑琪拉,よいお年頃ですものね。\n果たして縁談がまとまるか、\n気を揉む時期でしょう。,正是适婚的好年纪呢。\n婚事究竟能否顺利谈成，\n想必正是令人牵肠挂肚的时候吧。
80,サンチラ/桑琪拉,娘を送り出す前に嫁入り道具を\n用意するのも親の務めと存じます。\n準備はお済みですか？,在女儿出嫁前备好嫁妆，\n我想也是父母的职责。\n您准备好了吗？
81,父親/父亲,<span class='scene-font-4'>縁談！？　嫁入り！？</span>\nい、いや、その……\nそれも大事ではありますが……,<span class='scene-font-4'>婚事！？出嫁！？</span>\n不、不是，那个……\n那些确实也很重要……
82,父親/父亲,私はもっとその……\n進路とか、穏やかに過ごせるかとか、\nそういう一般的なことが心配なんです。,我更担心的是……\n她今后的出路、能否平安度日之类，\n这些普通的事情。
83,父親/父亲,嫁入りというのは……\nさすがに15歳では\nちょっと早いんじゃ……,至于出嫁……\n15岁未免还是\n有点太早了吧……
84,サンチラ/桑琪拉,そ、そうでしょうか……？,是、是这样吗……？
87,くろっこ/黑子,サンチラ、もう時代が違うんだよ。\nそのあたりだいぶ変わってるから。,桑琪拉，时代已经不同了。\n这方面早就变了很多。
88,サンチラ/桑琪拉,そ、そうだったの……？,原、原来是这样吗……？
89,サンチラ/桑琪拉,し、失礼いたしました！\nちょっとした戯れ言でした……！\nおほ、おほほほほ……,失、失礼了！\n刚才只是句玩笑话……！\n哦呵、哦呵呵呵呵……
90,父親/父亲,は、はぁ……,呃、呃……
91,,そしてサンチラは男の悩みを聞きつつ、\n心を込めて御朱印を書くのだった。,于是，桑琪拉一边倾听男人的烦恼，\n一边用心写下了御朱印。
92,サンチラ/桑琪拉,ひとまず喜んでいただけましたが、\nあれでよかったのでしょうか……,他姑且是很高兴，\n不过那样真的没问题吗……
98,サンチラ/桑琪拉,ふぅ……\nようやく最後のひとりの\n御朱印を書き終わりましたわ。,呼……\n总算为最后一位客人\n写完御朱印了。
99,サンチラ/桑琪拉,あの後も皆様との会話が\n噛み合わないことが続いたけれど……,在那之后，我和大家交谈时\n也一直有些对不上话……
100,？？？,てめぇ、さっきから\n喧嘩売ってんのか！？,你这家伙，从刚才开始\n就一直在找茬吗！？
101,ビィ/碧,な、なんだぁ！？,怎、怎么回事！？
105,目つきの悪い参拝客,ああ……そうだが、お前みたいな\nウスノロには、もっとはっきり\n言ってやったほうが良かったか！？,啊……没错。可你这种迟钝的蠢货，\n是不是非得说得更明白才听得懂！？
106,大柄な参拝客,てめぇ……\n<span class='scene-font-4'>言わせておけば！</span>,你这混蛋……\n<span class='scene-font-4'>别以为我会一直忍着！</span>
110,ルリア/露莉亚,あわわ……\n何かトラブルが起きてるみたいです……,哇哇……\n好像出什么乱子了……
111,サンチラ/桑琪拉,まぁ、奉納のお相撲でしょうか？,哎呀，是奉纳相扑吗？
112,ルリア/露莉亚,あ、そうなんですか？,啊，是这样吗？
113,サンチラ/桑琪拉,年越しには屈強な殿方が決闘を行い、\n五穀豊穣を願うと耳にしたことが……\n現代でも続いていたのですね。,我曾听说除夕之际会由强壮的男子决斗，\n以祈求五谷丰登……\n原来现代也还保留着这项传统。
114,目つきの悪い参拝客,やる気か！？,想动手吗！？
115,大柄な参拝客,ぶっ殺してやるよ！,老子宰了你！
116,ビィ/碧,いや、どう見ても喧嘩だろ！,不，怎么看都是在打架吧！
116-sel1_txt,,早く止めよう！,快去阻止他们！
116-sel2_txt,,ごっつぁんです,承让了
118,ルリア/露莉亚,そうですね！\nケガする人が出ないうちに！,说得对！\n得赶在有人受伤之前阻止他们！
120,ビィ/碧,おい、姬塔！\nスモウォーみてぇなこと言ってねぇで、\n早く止めるぞ！,喂，姬塔！\n别说什么相扑黑话了，\n快去阻止他们！
121,,その後、\n姬塔達が間に入り、\nなんとか喧嘩は収まるのだった。,之后，姬塔一行介入其中，\n总算平息了这场争斗。
132,ビィ/碧,ふー……\nどっと疲れたような気がするぜ……,呼……\n感觉一下子累瘫了……
133,ルリア/露莉亚,人も沢山いて、\nいろんなトラブルも\nありましたからね……,毕竟人那么多，\n还出了各种各样的乱子……
134,サンチラ/桑琪拉,……私、不甲斐ないです。,……我真是不中用。
135,ルリア/露莉亚,落ち込まないでください！\nサンチラちゃんは\nすっごく頑張ってました！,请不要消沉！\n桑琪拉已经非常努力了！
136,サンチラ/桑琪拉,ありがとうございます。\nですが今日一日で、今の私には\n至らない点が多々あると痛感しました。,谢谢您。\n但经过今天，我切身体会到\n现在的自己还有许多不足。
137,サンチラ/桑琪拉,今の世界の「普通」や「常識」を\n私はもっと知らなくてはなりません。,对于如今世界的「普通」和「常识」，\n我必须了解得更多才行。
138,サンチラ/桑琪拉,しかし、どうすれば……,可是，我该怎么做……
138-sel1_txt,,一緒に来る？,要和我们一起来吗？
138-sel2_txt,,これから学んでいこう！,今后慢慢学习吧！
140,サンチラ/桑琪拉,私が、姬塔様と共に……\nしかし、私のような未熟者では\nご迷惑ではないでしょうか……？,要我和姬塔大人一起……\n可是，像我这样尚不成熟的人，\n不会给各位添麻烦吗……？
141,ルリア/露莉亚,迷惑なんてことはありません！\nサンチラちゃん、私達と一緒に、\n今の空の世界を勉強しましょう！,才不会添麻烦！\n桑琪拉，和我们一起\n了解现在的空之世界吧！
143,ルリア/露莉亚,はい！\n私達と一緒に勉強しましょう、\nサンチラちゃん！,是的！\n桑琪拉，和我们一起学习吧！
144,サンチラ/桑琪拉,一緒に……？\n私が姬塔様の旅に\n同行するということでしょうか？,一起……？\n意思是要我同行，\n加入姬塔大人的旅途吗？
145,ビィ/碧,へへっ、\n当然、大歓迎だぜ！,嘿嘿，\n当然非常欢迎啦！
146,サンチラ/桑琪拉,あ、ありがとうございます……！\n本当に嬉しい限りですわ！,谢、谢谢各位……！\n我实在太高兴了！
148,サンチラ/桑琪拉,不束者ではありますが、\nこれからどうぞ\nよろしくお願いいたします！,我虽不才，\n今后还请各位\n多多关照！
149,,108年後の世界への期待と不安を胸に\n少女は姬塔の手を取る。,少女心怀对108年后世界的期待与不安，\n握住了姬塔伸来的手。
150,,こうして、今の世界を知るため、\n午神サンチラが\n姬塔の旅に加わるのだった。,就这样，为了了解如今的世界，\n午神桑琪拉加入了姬塔的旅途。
info,,,scene_fate_chr977_ep1
译者,,,GPT-5.6 Sol
