id,trans
filename,scene_evt221028_cp3_q1_s10
translator,GPT4o
info,scene_evt221028_cp3_q1_s10
148,斯依似乎受到了很大打击，垂下了肩膀。
147,斯依……
146,是这样吗……呜……能见面却不能聊天……
145,蕾妮有点怕生……
144,我觉得是蕾妮而不是沃夫先生不高兴了。
143,嗯，我觉得不是那样。
142,我是不是也惹他们生气了……对沃夫先生说他很大……
141,是我失礼了吗！？太没礼貌了吗！？呜呜呜……
140,我、我又做错什么了吗……？
134,果然会这样啊。
133,……
131,抱歉，请改天再来。
130,不好意思，她现在不太高兴。
129,啊……
128,不需要。
127,所以先带了点礼物作为见面礼！
126,因为是突然造访。困惑是非常正常的！
125,这还真是……突然啊。
124,是的！一定要好好聊聊！
123,吵到你们真是不好意思。只是他们想见见你们。
122,……真是热闹啊。如果不是来帮忙完成委托的，请简短一点。
121,……
120,那个可爱的孩子就是小红帽蕾妮？
119,哇～……真的有啊……
118,是的。
117,是艾鲁恩吧。看起来很奇特。
116,……狐狸？
115,哦……？
114,好，好大……好酷……
113,和父亲说的一样，甚至更胜一筹！真神一般神圣……
112,真是，真是雄壮！这就是狼人吗！啊，毛色鲜艳美丽！
111,……
110,怎么了，姬塔。需要帮忙完成委托吗？
108,敲门后，沃夫和背上的蕾妮探出了头。
102,姬塔苦笑着，带领斯依一行去沃夫和蕾妮的房间。
101,这样更快些……反正这个琵琶小姐，就算阻止也会找出来的。
100,总之……去把他们叫过来吧？
99,嗯……这个……嗯……
98,原来如此原来如此！去哪能见到他们？
97,那两人稍微有点特别……也不意外啦。
96,是这样啊……我还没见过呢。
95,何止是熟人，他们可是我们优秀的团员。还帮忙完成过几次委托呢。
94,是姬塔的熟人吗？
88,之后，寻找安全的地方，他们跟随着姬塔的旅程。
87,他们原本平静地生活，但被害怕传说的人们赶出了住处。
86,他们是在北广地区，姬塔一行遇到的狼人和少女。
85,沃夫和蕾妮
79,露莉亚的话让姬塔点了点头。
78,那个……刚才的故事，是在说沃夫先生和蕾妮吧……？
77,还有和狼人一起生活的小红帽，也一定要见见……！想和她搞好关系啊……
76,啊啊，但如果真的存在！我一定要亲眼看看！想见面聊聊天！
75,正确来说，应该叫做狼人族，不过我也只是听父亲说过。
74,真的有狼人吗？我从没见过……
73,你说得轻松，但那可是……库兹雷叔叔……
72,是的，当然！父亲什么都知道！
71,刚才的故事，也是听库兹雷先生说的吗？
70,哦……！狼人！！
64,「狼人和小红帽」
59,尽管外貌和经历不同，但同样孤独生活的两人，现在也继续生活着……
58,少女向怪物寻求保护，狼人誓言守护少女。
57,那是一次命运的相遇。改变了两人的命运。
56,他继续孤独地生活，最终，最终……最终。遇到了同样孤独生活的小红帽。
51,不知不觉间，只剩下一位心地善良的狼人。
46,他们袭击人们，人们与他们战斗。
45,很久很久以前，比现在遥远得多的过去。在极寒之地，有被人们恐惧的怪物——狼人。
40,接下来讲述的是，在孤独尽头相遇的一对孤独的狼人与少女的故事。
35,来，来来来来。听吧，听听吧。请听吧。
34,一开始一行人被震慑住了，但现在已经习惯了她的讲述，反而开始享受起来。
33,斯依弹起琵琶，变换声调开始讲述。
32,我来说吧。
31,是谁？
30,是的！准确来说，是想聊聊……看看那些人，但是！
29,志向未完成……？ 对了……你说过有很多想做的事呢。
28,嗯，还未完成志向。如果还能继续同行，我会非常高兴的。
27,不过，是不是该回去了？
26,感觉多了一个妹妹，我也很开心……
25,你们俩，真是关系变好了啊。
24,呵呵……
23,唔……
22,那算了。
21,你要是抱抱我，我就告诉你♪
20,说起来，你……我跟蔻哥表白后，你去哪了？
19,别得寸进尺。我才不会拥抱你呢。
18,哇哈！道谢的话，拥抱就可以哦？
17,谢谢。
16,是的……能好好用语言表达出来，真是太好了。
15,多亏了斯依，我感觉和蔻哥……更加亲近了……
14,别开玩笑了……不过，嗯……
13,还看到了容和蔻之间更美好的关系。呵呵……
12,不仅欣赏了大家的泳装，更重要的是美丽的萤火虫……
11,哇哈哈！比故事还要愉快，真是满足！多亏了大家，我非常开心！
10,一行人在享受了湖中的戏水和萤火虫观赏后，离开了有湖泊的岛屿。
9,容和蔻在经过误会和好后，过了几天──
0-synopsis,几天后，一行人离开了有湖泊的岛屿。斯依接着讲述了狼人与小红帽少女的故事，并表示想见见他们。姬塔一行人意识到这是在说团员沃夫和蕾妮，于是尝试将他们介绍给斯依。斯依带着礼物拜访沃夫和蕾妮的房间，满怀期待地想要交谈，但却被蕾妮冷淡地拒绝了。
0-chapter_name,第3话 不言而喻的爱