id,trans
filename,scene_evt161231_cp4_q3_s10
translator,gpt-4o-2024-08-06
info,scene_evt161231_cp4_q3_s10
35,姬塔一行找不到更多对他说的话，只能离开那里。
34,呃……对不起……
33,……抱歉，请让我一个人待着。
32,那、那个……小兄弟……？
31,缪恩再次将视线从姬塔一行转向了地面。
30,哦……这样啊……
29,我们来找机械师大叔修理夜间密码。
28,你们……为什么在这里？
27,那、那个……缪恩先生？
26,缪恩坐在堆积在船坞后面的废旧零件堆前，显得有些恍惚。
25,…………
24,走出船坞的姬塔一行很快就找到了缪恩的身影。
18,嗯，是啊！走吧。
17,……我们去找找吧。
16,听了凡吉奥的话，姬塔一行面面相觑。
15,他可能在哪儿哭着呢吧？那家伙真是没办法的孩子。
14,嗯？你是说缪恩吗？我也不知道。
13,喂，机械师大叔，那位冠军小子去哪儿了？
12,我很担心……
11,嗯，他看起来受到了很大的打击。
10,在比赛最后，缪恩先生的样子很奇怪……
9,确实是啊。不过好像看不到那小子的身影……
8,那确实是缪恩先生的快艇吧？
7,在船坞的深处，一艘快艇空空如也，显得有些寂寞地停在那里。
6,啊！碧先生，你看。那边的那个是……
5,哦！机械师大叔，拜托了！
4,我要去检查这东西，你们随便看看吧。
3,好！
2,不要随便碰那些东西。
1,哇，这里有好多不明白的机器和零件啊。
0,一行人与夜间密码一起前往凡吉奥的船坞。
0-synopsis,姬塔一行将快艇运到了凡吉奥的船坞，在等待维修期间，他们去寻找消失不见的缪恩。终于找到的缪恩显得非常沮丧，只留下了一句「请让我一个人待着」就离开了。姬塔一行再也找不到对缪恩说的话。
0-chapter_name,第四话 星号