id,trans
filename,scene_ult_chr344_ep2_q2_s10
translator,Claude 3 Opus
info,scene_ult_chr344_ep2_q2_s10
136,积累的记忆，以及它的所有者。\n那会是谁呢──
135,只是最后还有一点。\n接下来的话不过是推测，\n这点请你务必谅解。
134,沙哈尔闭上眼睛像是要结束话题，\n不久又像下定决心般重新睁开眼睛。
133,这样一来前提的话就说完了。
132,但还请再稍微陪我一下。\n就快说完了。
131,这是普通的反应吧。\n能听我说到这里，\n我已经非常感激了。
129,能得到你的赞同，\n感觉肩上的重担轻了一些。
127-sel2_txt,很难说……
127-sel1_txt,我认为是正确的
127,到这里为止的话，\n你怎么看？
126,这么想的话就能说得通了。\n不，应该说不得不说得通吗。
125,那个遗物终究只是核心的一部分，\n因此记忆也是片段式的。
117,当主将自身一分为二的时候，\n核心也被打碎散落一地。
116,<span class='scene-font-spword'>自我</span>……\n那个遗物是构成主的自我，\n可称为核心的东西吧。
115,那么那个遗物的存在意味着什么？\n积累的记忆能构成什么？
114,那个遗物很可能是一种<span class='scene-font-spword'>记忆装置</span>。\n我一碰到它，记忆就倒流而出，\n奔涌而过那样的景象和声音。
108,有一个只知晓这颗星球的蔚蓝，\n祈愿这颗星球的蔚蓝，\n追寻这颗星球的蔚蓝的人。
107,这些点连成了线，\n引出了一个推论。
106,不在这里的某个地方……\n不知是谁的声音……
87,但就在前几天。\n我在主的最后之地，\n偶然发现了某件遗物。
81,对于一个个涌现的疑问，\n多年来我都无法找到答案。
75,是否有非得在这颗星球不可的\n理由呢？
74,难道不存在\n其他更适合创世的星球吗？
73,为什么主会飞临这颗将要灭亡的星球，\n开始创世呢？
67,即使内含不安定因素，\n也要创造空之世界的理由是什么？
66,那么……\n赤红地平和幽冥世界的居民，\n对主来说是意料之外的产物吗？
65,他们企图入侵空之世界，\n至今仍作为威胁存在。
64,没错，就是赤红地平和幽冥世界的居民。
63,阻碍世界完成的不安定因素。\n即使以主的力量，\n也无法完全排除的东西……
58,主的创世完成了。\n在大多数方面。
57,就这样，在新生的世界里，\n充满了无数生命……\n这就是空之世界的开端。
44,之后经过漫长岁月，\n主飞临这颗星球，开始了创世。
38,曾经这颗星球被死亡笼罩。\n在古代战争的末期，地表被粉碎，\n走向灭亡的命运。
37,这几千年来……\n我一直怀有某个疑问。
36,抱歉。\n前言有点长了。
35,听了沙哈尔真诚的话语，\n姬塔神情凝重，\n默默地点了点头。
34,为了不让世界毫无理由地暴露在威胁之下。\n更重要的是，为了你自己。
33,所以你应该知道。\n神之力的本质和起源。
32,虽然这些都是假设。\n但今后不能保证不会发生。
31,但假如那股力量失控的话，\n你自己就会变成威胁。\n有可能成为毁灭的源头。
30,那时你虽然出色地操纵了那股力量，\n拯救了世界的危机……
29,如果你有这个念头的话，\n毁灭世界也不是天方夜谭。
28,创造天空世界、连不死者都能杀死的力量……\n这完全超越了人类的智慧。
26,你引出了神之力，\n击退了菲尼克斯。\n却不知其本质为何。
20,简直令人怀念啊。
19,那股力量正是……！
18,这就是创世神的……
17,……──
10,就是那件事啊。
8-sel1_txt,为什么要对我说？
8,但既然得出了这个结论，\n至少希望你能听我说完。
7,我接下来要说的话，\n等同于揭开那个神秘。\n如果说没有迷惘那就是骗人。
6,神就是<span class='scene-font-spword'>神秘本身</span>。\n或者说<span class='scene-font-spword'>本应是神秘的存在</span>。
5,请别在意。\n对大多数人来说，神等同于空想。\n只要不怀疑祂的存在就足够了。
4,说实话几乎一无所知……\n对一脸抱歉回答的姬塔，\n沙哈尔温柔地微笑。
3,说到根本的问题，\n你对神除了创世神话之外还有什么了解吗？
2,在进入正题之前需要先整理一下。\n你也是，我也是。
1,是不是说得太急了。\n抱歉。\n虽然表面如此，但内心无法保持冷静。
0-synopsis,路西欧坦白，他一直在思考「为什么神要在这颗星球上进行创世」这个问题，并从神秘长枪获得的信息中得出了一个推论。首先作为前提，路西欧阐述了自己的观点，认为长枪是一种记忆装置，是构成神之自我的核心所碎裂的一部分。那么，对这颗星球怀有强烈执着的记忆持有者到底是谁──路西欧讲述了自己得出的推论。
0-chapter_name,神之起源