id,trans
filename,scene_evt220130_cp6_q2_s10
translator,gpt-4o-latest
info,scene_evt220130_cp6_q2_s10
92,在一旁，店长的肩膀愈加垂下。
91,寂静的店内，回荡着卡西乌斯满是惊愕的声音。
90,到底，为什么……！我吃过的那拉面，到底去了哪里……！？
89,只是，味道比我以前吃的差了好几级。这样只能说是平庸以下。
88,……确实，这就是招牌拉面。我的味觉是这么判断的。
87,但下一刻，他也像两人一样沉重地摇头。
86,卡西乌斯露出难以相信两人话语的表情，尝了一口拉面。
85,…………
83,不可能的……！
82,是，是啊……果然我的招牌拉面不行……
81,什，什么！？
80,这样不行。
79,……然而，尝了一口端上来的招牌拉面后，一发和莉露露同时摇头。
74,卡西乌斯为店长恢复元气以及能再次品尝到招牌拉面而感到高兴。
73,啊，终于能再吃一次那拉面了……！
72,真的吗？那就拜托了。
71,是否推出新作，就让吃了的各位来判断怎么样？
70,……好吧。既然你们这么说，那我再做一次招牌拉面试试。
69,三人一起劝说后，店长犹豫着终于点头了。
68,店长先生，至少请给莉露露他们做一次招牌拉面好吗？
67,卡西乌斯先生都这么说了，莉露露也非常感兴趣！
66,那种拉面一定能让顾客和所谓的拉面三骑士都满意！
65,我渴望再次品尝你做的拉面。那拉面是那样的美味……！
64,……店长，请回忆一下。那温柔的招牌拉面的味道。
63,…………
62,但那是你倾注各种心血制作的魂之拉面吧？
61,虽然我还没有吃过招牌拉面……
60,但是……正因如此。让我们做招牌拉面吧。
59,如果被贬低两次，心真的会碎的。
58,招牌菜单对于职人来说是自己的骄傲。
57,一发轻轻拍着看起来很无奈的店长的背说。
56,我很理解这种心情……
55,…………
54,但，那些人却……严厉批评了……
53,招牌拉面是我的拿手好菜。曾经让这家店一时兴旺的自豪菜单……
52,但我实在没有勇气。
51,说来惭愧……
50,你真的不想推出吗？
49,……！
48,我仍然认为招牌拉面是这家店的特色。
47,抱歉店长，我也同意这种看法。我认为继续开拓新领域不是明智之举。
46,随便做自己不擅长的东西，对顾客和拉面都是不敬！
45,<span class='scene-font-spword'>「做美味的拉面」</span>这个目标被忽视了！
44,对，这就是问题所在！
43,不过，只是读了文献，做得不是很好吃……
42,这个是我在文献中读到用剑削面的拉面，模仿做出来的。
41,这边是辛辣汤里放了很多肉末的重口味拉面……
40,什么……这是新作品。
39,这，这是什么，这一排排的面条是怎么回事！
38,店长，我真的看不下去了！
37,对于这种迷茫的状态，终于叫停的是一发。
36,店长每天都在创造新作品，然后又放弃。
30,…………
29,那就试试辣面吧……
28,唉，果然是这样啊……
27,在短时间内找到完美的调合相当困难。很遗憾，但还是试试别的吧。
26,……不，这不行。每种汤的味道都是独立的，呈现出分散的状态。
25,…………
23,确实很有趣。那就赶紧……
22,我觉得这样味道会更浓厚……
21,是的，我用鸡肉、海鲜和猪骨分别做了汤，然后混合在一起。
20,嗯？新作品做好了吗。请让我试吃一下。
19,小子，这个怎么样？
12,是吗，是这样啊……
11,如果突然开始提供蘸面，只会是临时抱佛脚。
10,不过，那些店都有明确的理念。
9,的确，有些店同时提供拉面和蘸面。
8,不，不行吗……我觉得挑战新领域也不错……
7,……这不就是蘸面吗！
6,故意不将面放入汤中的创新摆盘，这样的话……
5,嗯嗯……粗粗的面条和浓厚的海鲜蘸汁……
3,那个，这样的怎么样？
2,在油星店内，店长正拼命构思新菜单，而姬塔一行则在帮忙。
1,自拉面三骑士来访后，过了几天。
0-synopsis,数日后，店长为了表演拼命地构思新菜单，但完全迷失了方向。在卡西乌斯和一发的劝说下，店长决定让姬塔他们尝一尝他的招牌拉面。卡西乌斯终于可以吃到招牌拉面了，感到很高兴，但店长做的招牌拉面味道比以前差了好几级。卡西乌斯感到震惊，店长更加失落。
0-chapter_name,第6话 流星、三骑士