id,name,text,trans
0-chapter_name,,第3話 守りてーとか思っちゃって,第3话 想要守护
0-synopsis,,ユッコの一件を解決したローアイン達だったが、翌朝、ラーライラから思い出の公園がなくなると聞かされる。カッちんに話を聞きに行くと、公園のある土地はマフィアのマイス・ファミリーが購入しており、カジノになる予定らしい。どうにかならないか相談するローアイン達は、マフィアから公園を買い戻すために一攫千金を目指して行動を始める。,罗艾因等人解决了尤可的事件，但第二天早上，他们听说怀念的公园将被拆除。询问卡钦后得知，公园所在的土地已被黑手党梅斯家族买下，计划建成赌场。为此，罗艾因等人商议如何解决这一问题，决定通过一攫千金的方式从黑手党手中买回公园。
8,ローアイン/罗艾因,いやユッコとセロリがくっつくとか、\nビビり散らかして\n途中から記憶ねぇわ。,尤可和芹菜凑到一起的时候，我吓得半路就不记得了。
9,エルセム/艾尔塞姆,セロリずっと片恋してたんだな。\nぴくちり気づかんかった。\nでもよかったなー！,芹菜一直单恋着呢。我完全没察觉。不过真是太好了！
10,トモイ/托莫伊,セロリならユッコも幸せになれんべ。\nなにしろアレよ？\nセロリは甲斐性から生まれた漢よ？,芹菜的话，尤可肯定也能幸福吧。毕竟芹菜可是靠本事的汉子嘛。
11,ラーライラ,アンタはどうなんだい。\nでもほんとによかったね。\nセロリもユッコもいい子だから。,你怎么样呢。不过真的太好了。芹菜和尤可都是好孩子嘛。
12,ラーライラ,ていうか毎朝毎朝\nアンタ達ばっか来てないで、\nまた皆連れて来な。,而且啊，你们每天早上都来，不如带大家一起来吧。
13,エルセム/艾尔塞姆,え、いいの？,诶，可以吗？
14,ラーライラ,今更だろう。前はよく来てたんだし。\nアタシも皆に会いたいからね。\nスター君の整った顔も拝みたいし。,这有什么。以前不也常来吗。我也想见大家嘛。还想看看那位明星君的帅脸呢。
15,ローアイン/罗艾因,母ちゃんイケメン好きだもんな。\nでもそのうち見飽きるベ？\n俺ら見てもなんも思わねーべ。,老妈你就是喜欢帅哥。不过看久了会腻吧？看我们都没啥感觉。
16,ラーライラ,あ、そういやアンタ達聞いた？,啊，对了，你们听说了吗？
17,ローアイン/罗艾因,無視！！,无视！！
18,ローアイン/罗艾因,で、なによ？,所以，啥事？
19,ラーライラ,アンタ達がよく遊んでた公園、\n取り壊されるみたいだよ。,你们常玩的那个公园，好像要被拆掉了。
20,３人,はぁぁぁ！？,啥ぁぁぁ！？
34,ローアイン/罗艾因,はぁ、はぁ……\nあー……っだコラ……\n走り回って青春すぎんよ……,哈，哈……啊……这家伙……跑来跑去的，真是青春啊……
35,ローアイン/罗艾因,……とりま、公園自体は\n無事っぽで安心だわ。,……总之，公园本身好像没事，这样就放心了。
36,エルセム/艾尔塞姆,とりま来てみたけど……\nなっつかしーなー！\n久々に５枚葉のクローバーとか探す？,总之我们来了……真是怀念啊！要不久违地找找五叶草？
37,トモイ/托莫伊,ちょちょちょ！\nこれ！　これ見ろし！\n掲示板にでっけー貼り紙あったわ！,哎哎哎！这个！快看这个！公告牌上有个大贴纸！
38,ローアイン/罗艾因,いやいやいやいやオメ、\nそういうの剥がすの怒られっから！\n返してきなさい！,不不不不你，这种东西揭了会被骂的！快去还回去！
39,トモイ/托莫伊,ウッス……,是……
46,ローアイン/罗艾因,なになに……取り壊し予定……\n来月じゃねーか！\nマジで壊すんか……,什么什么……计划拆除……下个月吗！真的要拆吗……
47,エルセム/艾尔塞姆,えぇ……\n俺らこの公園で育ったっつっても\n過言じゃねーべ。,诶……说我们是在这个公园长大的也不为过吧。
48,トモイ/托莫伊,いや流石に過言だわ。\nけどまぁここの管理人さんは\n親の顔より見てるよな。,不，这就有点夸张了。不过这里的管理员我们是比自己爸妈还熟的吧。
49,ローアイン/罗艾因,いや過言２よ。\nつーか、空き地も減ってっし、ここも\nマイス・ファミリーのアレだったり？,不，夸张了。话说，空地也越来越少，这里是不是也被梅斯家族盯上了？
50,トモイ/托莫伊,あーカッちんが言ってたやつか。\n……なんか事情知ってっかもな。,啊，卡钦说过的那个吗。……可能知道些什么。
51,エルセム/艾尔塞姆,ちょい聞きに行ってみんべ。,去问问看吧。
59,カッちん,悪いな、仕事終わるまで\n待ってもらって……うほっ。,不好意思，让你们等我工作结束……哎呀。
60,エルセム/艾尔塞姆,気にすんなし。俺らヒマだから。\nでも忙しいのな、カッちん。,别在意，我们反正闲着。不过还挺忙的啊，卡钦。
61,カッちん,まぁフツーよ。\nんで？　公園だっけ。,还算正常吧。然后呢？是说公园吧。
62,ローアイン/罗艾因,それよ！　つかこれよ！,就是这个！就是这个！
63,,ローアインが懐から取り出した\n貼り紙──の模写を\nテーブルに叩きつける。,罗艾因从怀里拿出一张贴纸——的复印件，拍在桌上。
64,カッちん,<span class='scene-font-4'>持ってきたのかよ！？</span>\nマフィアに叱られんぞ……,你拿来了！？会被黑手党骂的……
65,トモイ/托莫伊,あーこれ模写したヤツよ。\n……ってことはこれもやっぱ\nマイス・ファミリーが噛んでる系？,啊，这是复印件。……就是说这也是梅斯家族插手的？
66,カッちん,そ。なんかここにカジノ作るらしい。,对。好像要在这里建个赌场。
67,ローアイン/罗艾因,カジノ？\nちょ、詳しく。,赌场？说说清楚。
68,カッちん,んー……\nプレトーってさ。\nなんもねーじゃん。,嗯……普雷托嘛。啥都没有。
69,ローアイン/罗艾因,いやむしろなんでもあんべ。\n不足ねーべ。,不不，反而什么都有吧。不缺东西。
70,エルセム/艾尔塞姆,駄菓子屋も祭りの広場もサ店も。\n飲み屋も遊び場も多いし\n図書館だってあんべ。,有小吃店、祭典广场和咖啡店。酒吧和娱乐场所也多，还有图书馆。
71,カッちん,じゃなくて。\n暮らすのに不足はねーけど、\nわざわざ外から人が来る理由がねーべ。,不是这个。生活是不缺啥，但没有理由让外面的人专程来。
72,トモイ/托莫伊,ババ・スライスがあるっちゃ！！,有巴巴·斯莱斯啊！！
73,カッちん,いやそれで観光誘致出来んから。\nお前らだって、ここに居ても\n面白くねーから本島に出たんだべ？,不，那吸引不了游客。你们不也觉得在这里没意思才去了本岛吗？
74,ローアイン/罗艾因,まぁ……なんつーの？\nキラキラが？　足んねーなって？,嗯……怎么说呢？觉得没什么闪光点？
75,エルセム/艾尔塞姆,華がねえもんな、プレトー\n本島に近いからって\n人だけは多いけど。,普雷托确实没什么光彩，虽然靠近本岛，人倒是多。
76,トモイ/托莫伊,遊ぶなら本島だもんな。\n大事な地元には違いねーけど。,玩的话肯定是去本岛。不过当地还是很重要的。
77,カッちん,そ。だいたいのもんは\n本島にあるだろ？\nで、本島には観光客も多い。,对。本岛几乎什么都有。而且游客也多。
78,カッちん,じゃあプレトーにもなんか作れば\n本島の観光客が流れてくんじゃね？\nって寸法なわけよ。,所以在普雷托也建点什么的话，本岛的游客可能会过来吧。就是这么个打算。
79,ローアイン/罗艾因,なんか作るってなによ？\nカジノ？,建点什么是指啥？赌场？
80,カッちん,俺が聞いたのは\n公園跡地にカジノ作るっつーのと\n裏町に夜の店増やすって。,我听说的是在公园旧址建赌场，还有在后街增加夜店。
81,カッちん,空き地が減ってんのも\nそういう次第。,空地减少也是这个原因。
82,エルセム/艾尔塞姆,なるほじ鼻ホジだわ。\nつかさ、そこまでやったら\nプレトーも活気出んじゃね？,原来如此。说实话，这么搞的话，普雷托也会变得有活力吧？
83,トモイ/托莫伊,いやいや……マフィアが商売始めたら\nクリーンな商売が全滅するわ。\nヤカラも入ってくるっぺや。,不不……黑手党一旦开始做生意，干净的生意就完蛋了。混混们也会涌进来吧。
84,ローアイン/罗艾因,それよ。\nこないだのヒモよりッベーのが\n山盛りさんだべ。,就是这个。会有比之前那些游手好闲的家伙更糟糕的出现吧。
85,トモイ/托莫伊,あとさ、マフィアの商売がコケた時、\n地元民からカツアゲするらしいんだわ。\n「ハニワなるドン」で読んだべ。,还有啊，我在「哈尼瓦成唐」上看到过，黑手党的生意失败时会从当地居民那里敲诈钱财。
86,カッちん,実は、そういうのを心配する声も\n前から結構上がってんだわ。,其实，早就有不少人担心这种情况。
87,カッちん,……全部、マフィアが“話し合い”で\n解決しちまってっから、\n最近誰も言わねーけど。,……所有问题都被黑手党通过「谈判」解决了，所以最近没人再说了。
88,エルセム/艾尔塞姆,……普通に地元の危機じゃね？,……这不就是本地的危机吗？
89,ローアイン/罗艾因,つかよ、あの公園潰してカジノとか、\nフツーに無理じゃね？\n俺らのメンタル的に。,话说，把那个公园拆掉建赌场，对我们心理上来说不太可能吧。
90,トモイ/托莫伊,それな。\nあの公園は思い出がいっぱいなんだわ。\nタイムカプセルも埋まったままよ？,就是这个。那个公园满是回忆。时间胶囊也还埋在那里呢？
91,カッちん,それ埋めてねぇパティーンだべ。,那是没埋下的。
92,ローアイン/罗艾因,なんとかなんねーかな。\nこのまま俺らの思い出が奪われんの\n黙って見てらんねーべ。,难道就没办法了吗。眼睁睁看着我们的回忆被夺走，真是坐不住啊。
93,エルセム/艾尔塞姆,つっても相手はマフィアよ？\nＤｏする？,可对手是黑手党啊？怎么办？
94,カッちん,マフィアだから……\n金でなら解決できそうだけど……,因为是黑手党……用钱似乎能解决……
95,エルセム/艾尔塞姆,金？,钱？
96,カッちん,シンプルにマイス・ファミリーから\n公園を買い戻せれば、\nワンチャン公園守れるかも的な。,简单来说，如果能从梅斯家族手中买回公园，也许有机会能保护公园。
98,トモイ/托莫伊,それだ！！,就是这个！！
99,カッちん,いやいや、待てし。\nんな金ねーべ？,不不，等等。那样的钱哪里有？
100,エルセム/艾尔塞姆,金がないなら作ればいいじゃない！,没钱的话就去赚啊！
101,ローアイン/罗艾因,つっても時間ねぇかんな！\n狙うは……,可时间不多了！我们的目标是……
102,３人,一攫千金！！,一举成名！！
info,,,scene_evt241128_cp3_q1_s10
译者,,,gpt-4o-latest