id,name,text,trans
0-chapter_name,,第2話 ヒトサガシ×ハ×ヒトクロウ,第2话 寻人×与×辛劳
0-synopsis,,ラコボファミリーは元々ペラーゴの自警団のひとつであったが、「莫大な富と破滅をもたらす存在」と伝えられる星晶獣アンドサの封印を破り、その力を用いて勢力を増したのだという。ペラーゴで起きている行方不明事件もそのアンドサが関係している可能性があることを知った一行は、ラコボファミリーの居場所を突き止めるべく、ゴンとサラーサの嗅覚を頼りに遺跡調査へ乗り出すのだった。,拉科波家族原本是佩拉戈的自警团之一，但他们打破了被传为「带来巨大财富与毁灭的存在」的星晶兽安德萨的封印，并利用其力量扩大了势力。得知佩拉戈发生的失踪事件也可能与安德萨有关后，一行人为了查明拉科波家族的所在之处，决定依靠冈和萨拉萨的嗅觉，着手调查遗迹。
1,ゴン,ラコボファミリー……？,拉科波家族……？
2,ビィ/碧,調査の時に名前が出てたな。\nたしか……ここ最近で急に大きくなった\nマフィアだって。,调查的时候听到过这个名字。\n我记得……是最近突然壮大起来的\n黑手党。
3,クラピカ,ああ、ラコボは今でこそ、ペラーゴの\n地下組織の元締めだが、少し前までは\n弱小の組織に過ぎなかった。,嗯，拉科波现在虽然是佩拉戈\n地下组织的头目，但不久前还只是个\n弱小的组织。
4,クラピカ,彼らの勢力が急拡大した背景には\n莫大な財力がある。明らかに組織力を\n超えた財宝を、ラコボは手にしていた。,他们势力急剧扩张的背后\n有着巨大的财力。拉科波掌握了\n明显超出其组织能力的财宝。
5,ゴン,財宝……？　どういうこと？\nすっごくおっきなスポンサーでも\nついたの？,财宝……？什么意思？\n是有了个超级大的赞助商\n之类的吗？
6,キルア,……それが星晶獣の力ってことか？,……这就是星晶兽的力量吗？
7,クラピカ,そうだろうな。空の世界においても、\n今起きている現象は星晶獣以外では\n説明がつきにくいことだ。,应该是吧。就算在空之世界，\n现在发生的现象除了星晶兽以外\n也难以解释。
8,クラピカ,私はラコボと星晶獣の関連を疑い、\n調査の対象をそちらに絞ることにした。\nそしてその過程で──,我怀疑拉科波和星晶兽有关联，\n于是将调查对象锁定在了那边。\n然后在这个过程中──
15,荒くれ者１/小混混１,テメエか！　星晶獣について\n嗅ぎまわっているってやつは！,是你小子吗！到处打听\n星晶兽消息的家伙！
16,荒くれ者２/小混混２,余計なことに首つっこむんじゃねえ！\n痛い目みないと分からねえのか！,别多管闲事！\n不吃点苦头是不懂吗！
17,クラピカ,ほう、何か知っているのか。\nちょうどいいところに来てくれたな。\n少し話し合おう。,哦，你们知道些什么吗。\n来得正好。\n我们稍微谈谈吧。
25,クラピカ,で、“話し合い”の結果、\n彼らが快く協力して\nくれることになったというわけだ。,于是，在「商谈」之后，\n他们就爽快地答应\n协助我们了。
26,荒くれ者たち,あの時は生意気言って\nすみませんでしたああっ！！,那时候说了些嚣张的话\n真是对不起啊啊啊！！
27,ビィ/碧,本当に話し合いか……？\n滅茶苦茶怯えているように\n見えるんだけど……,这真的是商谈吗……？\n他们看起来害怕得要死\n的样子……
28,キルア,（こいつもこういう時わりと\nケンカっ早いんだよな～……）,（这家伙在这种时候也挺\n好斗的嘛～……）
29,荒くれ者１/小混混１,オレたちはペラーゴにいくつかある\n古い自警団です……本当はラコボも\nそのひとつだったんですけど……,我们是佩拉戈的几个\n古老自警团之一……其实拉科波\n原本也是其中之一……
30,荒くれ者２/小混混２,あいつら、禁忌に手を出したんだ！\n秘匿を忘れて、\n「アンドサ」の封印を破りやがった！,那帮家伙，触碰了禁忌！\n忘记了保密的原则，\n打破了「安德萨」的封印！
31,アレク,<span class='scene-font-spword'>アンドサ</span>……？\nそれが星晶獣の名前なのか？,<span class='scene-font-spword'>安德萨</span>……？\n那是星晶兽的名字吗？
32,クラピカ,ああ、そうだ。その昔、ペラーゴ内部の\nいくつかの自警団が協力して封印し、\nその存在を秘匿していた星晶獣だ。,嗯，是的。那是很久以前，由佩拉戈内部的\n几个自警团协力封印，\n并将其存在秘而不宣的星晶兽。
33,クラピカ,曰く<span class='scene-font-spword'>「莫大な富と破滅をもたらす存在」</span>\n彼らの間にはそれだけが\n伝えられていたようだ。,据说那是<span class='scene-font-spword'>「带来巨大财富与毁灭的存在」</span>\n在他们之间似乎\n只流传着这句话。
34,ビィ/碧,「莫大な富と破滅」……？\nどういうことだ……？,「巨大财富与毁灭」……？\n这是什么意思……？
35,クラピカ,それ以上は、私も彼らも知らない。\nどうやら自警団の間でも、アンドサに\nついて語ることは禁じられていた様だ。,更详细的，我和他们都不知道。\n看来在自警团之间，谈论有关安德萨的\n事情也是被禁止的。
36,キルア,だから具体的にどうヤベーのか\n伝わってねえのかよ。なんでそんな\n歪なことになってんだ？,所以具体有多不妙\n根本没流传下来吗。为什么会变成\n这么扭曲的情况？
37,クラピカ,私もそれは考えていた。\nきっちりと管理をするなら、星晶獣の\n情報も含めて把握しておくべきだ。,我也考虑过这个问题。\n如果要进行严格管理，就应该连同星晶兽的\n情报也一并掌握。
38,クラピカ,だが、理由の推測はつく。\n「何が起きるかを知ること自体が、\n人心を蝕む毒になる」場合だ。,不过，理由可以推测出来。\n那就是「知晓会发生什么这件事本身，\n就会成为侵蚀人心的毒药」。
39,ゴン,知るだけで毒になる……\nそんなことあるの？,只是知道就会变成毒药……\n有这种事吗？
40,キルア,んー……「富を与える」ってのから\n考えるなら、抜け駆けして富を\n得ようってやつが現れるからか？,嗯……从「给予财富」这点来\n考虑的话，是因为会出现想要\n抢先一步获得财富的家伙吗？
41,キルア,金の魅力に抗えねーやつは多いだろ？\nだから具体的な話を残さないように\nしたってのは分からなくもねえぜ。,抵抗不了金钱魅力的人很多吧？\n所以为了不留下具体的情报，\n这么做也不是不能理解。
42,クラピカ,考え方の方向性は合っている。\nだが、想定が甘いな。この前提ならば\nもう一手踏み込んで考えられるはずだ。,思考的方向是正确的。\n但是，设想得太天真了。在这个前提下\n应该能再深入思考一步。
43,キルア,オメー相変わらずだなあ～……\nなんだよ、「もう一手」って──,你这家伙还是老样子啊～……\n什么啊，「再深入一步」是指──
44,キルア,……あ！　そうか！　星晶獣の能力が\n「他人にリスクを負わせて富を得る」\nって物だった場合ってことか？,……啊！是这样！就是说星晶兽的能力\n是「让别人承担风险来获取财富」\n这种情况吗？
45,クラピカ,そういうことだ。「富と破滅」の破滅は\n「金に目が眩んで身を滅ぼす」という\n言葉と取れなくもないが……,就是这样。「财富与毁灭」中的毁灭\n虽然也可以理解为\n「利欲熏心而自取灭亡」……
46,クラピカ,もっと直接的な破滅……\nたとえば「生贄を捧げれば富を与える」\nというものである可能性はないか？,会不会是更直接的毁灭……\n比如说「献上祭品便给予财富」\n这种可能性呢？
47,ゴン,それじゃあ……\n行方不明になってる人は……,那么……\n那些失踪的人……
48,ビィ/碧,そのアンドサって星晶獣の\n生贄になってるかも\nしれねえってことか……？,意思是说可能成了\n那个叫安德萨的星晶兽的\n祭品吗……？
49,クラピカ,詳細は分からないがな。\nアンドサの能力は今のところ解き放った\nラコボの者たちしか分からないのだよ。,详情还不清楚。\n安德萨的能力目前只有解放了它的\n拉科波家族的人才知道。
50,ルリア/露莉亚,あれ？　でもどうしてクラピカさんは\nこの遺跡にいるんですか？　ラコボの\n人たちを調べた方がいいような……,咦？但是酷拉皮卡先生为什么\n会在这座遗迹里呢？去调查拉科波\n家族的人不是更好吗……
51,クラピカ,当然、調べようとしているさ。\nだが、ラコボの人間たちの足取りが\nまったく掴めないんだ。,我当然也正打算调查。\n但是，完全掌握不到\n拉科波家族那些人的行踪。
52,キルア,まったく、か。そりゃきな臭いな。\n街にそいつらの拠点はなかったのか？,完全吗。那可真是可疑啊。\n城里没有他们的据点吗？
53,クラピカ,おそらく地下に隠れているのだろうな。\n故に私たちは網を張っていた。,恐怕是藏在地下了吧。\n因此我们布下了天罗地网。
54,クラピカ,我々自警団が管轄するエリア内にある、\nアンドサに関連する遺跡をな。,在我们自警团管辖区域内，\n与安德萨相关的遗迹。
55,ビィ/碧,それがこの遺跡ってことか。アンドサの\n話を知らない島民たちにすりゃあ、\n普通は立ち寄らない場所だもんな。,就是指这座遗迹吗。对于不知道\n安德萨事情的岛民来说，\n这确实是平常不会靠近的地方。
56,クラピカ,ここに来る者が何かを知っている\n可能性が高かった……仲間が逸って\nしまうのは想定外だったがな。,来到这里的人很可能\n知道些什么……不过同伴会如此\n急躁倒是意料之外。
57,荒くれ者１/小混混１,ほんと申し訳ないです……,真的非常抱歉……
58,クラピカ,さて、一通り経緯は伝えた。\nこちらからも聞いていいだろうか。,好了，经过大致都说明了。\n我这边也可以问些问题了吧。
59,クラピカ,君たちはどうやって\nこの場所を突き止めたんだ？,你们是怎么\n找到这个地方的？
60,アレク,うーん、と言われてもな。\n街の調査の合間にたまたま見つけた\nだけだったし……,嗯—，你这么问嘛。\n也只是在调查城镇的间隙碰巧\n发现的……
61,クラピカ,だが、人手を連れて戻ってきただろう。\n今回は明らかに確信を持って\n調査に訪れている様子だった。,但是，你们带着人手回来了吧。\n这次明显是带着确信\n前来调查的样子。
62,クラピカ,何か星晶獣に関して私の知らない\n知識があるのであれば知っておきたい。\n感知する方法があるのだろうか？,如果有什么关于星晶兽我所不知道的\n知识，我很想了解。\n是有感知它的方法吗？
63,,真剣な表情で尋ねるクラピカに、\nゴンはバツの悪そうな表情を見せる。,面对表情认真地询问的酷拉皮卡，\n冈露出了不好意思的表情。
64,ゴン,ええ～っと……なんていうか\nあんまり参考にならないかも……,呃～……该怎么说呢，\n可能没什么参考价值……
65,クラピカ,なぜだ？　私たちでは再現が\n不可能なものなのか？,为什么？是我们无法\n重现的方法吗？
66,ゴン,実はその──……\nサラーサと一緒に鼻を使って\n調査してたんだよね。,其实那个──……\n我是和萨拉萨一起用鼻子\n进行调查的。
67,クラピカ,は？　鼻？\nつまりその……嗅覚か？,哈？鼻子？\n也就是说……嗅觉吗？
68,サラーサ/萨拉萨,おう！,哦！
74,クラピカ,ぷっ……はははは！！\nいや、失礼。まさか嗅覚だとはな！\nどうりで私たちでは気づかないわけだ！,噗……哈哈哈哈！！\n不，失礼了。没想到竟然是嗅觉！\n怪不得我们没能注意到！
75,ルリア/露莉亚,一応、クラピカさんの考え通り\n私が星晶獣の気配を\n感じることが出来るんですが……,姑且，就像酷拉皮卡先生想的那样\n我是能够感觉到\n星晶兽气息的……
76,ルリア/露莉亚,今のところアンドサ……\nどころか星晶獣の気配を\nまったく感じないんです。,但目前别说安德萨了……\n就连星晶兽的气息都\n完全感觉不到。
77,クラピカ,なるほど。もしかすると\nラコボの者たちが星晶獣を秘匿する\n術を持っているのかもしれないな。,原来如此。或许\n拉科波家族的人们拥有\n隐藏星晶兽的方法也说不定。
78,アレク,でも、ゴンとサラーサの嗅覚は\n想定外だったわけだ。,不过，冈和萨拉萨的嗅觉\n是他们没想到的吧。
79,クラピカ,ふふ……そのようだ。,呵呵……似乎是这样。
80,ビィ/碧,でもよ！　誰も思いつかなかったって\nことは、この方法なら何か手がかりが\n見つけられるかもしれねえぜ！,不过啊！既然谁都没想到，\n那就说明用这个方法或许能\n找到些什么线索哦！
81,ゴン,そうだね！\n<span class='scene-font-4'>やろう、サラーサ！</span>,说得对！\n<span class='scene-font-4'>上吧，萨拉萨！</span>
82,サラーサ/萨拉萨,おう！　まかせろ！,哦！交给我吧！
83,ふたり/两人,くんくんくん……,嗅嗅嗅……
86,キルア,（なんか、\nでっかい犬みてえだな……）,（总觉得，\n好像大狗狗啊……）
87,,ゴンとサラーサは嗅覚を頼りに、\nしばらくの間遺跡を調べていたが、\nやがてある壁の前で立ち止まった。,冈和萨拉萨依靠嗅觉，\n在遗迹里调查了一段时间，\n最终在某面墙前停了下来。
90,サラーサ/萨拉萨,ここだ！　ここが一番\nにおいが強くなってるぞ！,就是这里！这里的\n气味最浓！
95,クラピカ,僅かに反響音が異なっている。\nどうやら向こう側に空間があるようだ。,回响声有细微的差异。\n看来对面有空间。
96,クラピカ,お前たち、事前調査の際に、\nこの遺跡に別の入り口はあったか？,你们，在事先调查的时候，\n这座遗迹有别的入口吗？
97,荒くれ者１/小混混１,いえ、親分。正面の入り口以外には、\n鼠一匹入れる隙間も無かった\nはずですぜ！,不，老大。除了正面的入口以外，\n应该连老鼠能钻进去的\n缝隙都没有！
98,クラピカ,（人が日常的に出入りしているわけでは\nないのか？　だが、だとすれば何故\n香りが残っている……？）,（并不是有人日常出入吗？\n但如果是这样，为什么\n会留下气味……？）
99,ゴン,入るところ見当たらないみたいだし、\nオレが壁壊しちゃうね！,好像找不到进去的地方，\n那我把墙壁打坏吧！
100,クラピカ,待て、ゴン！\nここは歴史ある遺跡だぞ！,等等，冈！\n这里可是有历史的遗迹！
101,クラピカ,異世界とはいえ、ハンターたるもの、\n歴史への敬意を失ってはならない。\n無闇に破壊することは看過できないよ。,虽说是异世界，但作为猎人，\n不能失去对历史的敬意。\n我不能容忍肆意破坏的行为。
102,キルア,でも他に入り口は見あたらねえんだろ？\n行方不明者も出てるし、あまり悠長に\nやってる暇ねーんじゃねえの？,但是也找不到其他入口了吧？\n还有人失踪了，可没时间\n这么优哉游哉的吧？
103,クラピカ,それはそうかもしれないが……\nだが、現地の人間の許可もなく\nそのようなことなど……,话虽如此……\n但是，没有得到当地人的许可\n就做这种事……
104,荒くれ者１/小混混１,親分！\n俺たちは全然気にしませんよ！,老大！\n我们完全不介意！
105,荒くれ者２/小混混２,そうです！　そうです！\n一思いにぶっ壊しちゃってくだせえ！！,是啊！是啊！\n请您下定决心把它砸了吧！！
106,クラピカ,気にして欲しいところだが……\n仕方ない。だが、該当の壁以外は\n傷を付けないように気を付けてくれ。,我倒是希望你们介意一下……\n没办法了。但是，除了那面墙壁之外\n请注意不要造成损伤。
107,サラーサ/萨拉萨,任せておけって！\n<span class='scene-font-4'>よーし、全力で行くぞぉぉぉぉ！</span>,包在我身上！\n<span class='scene-font-4'>好—，我要全力上了喔喔喔喔！</span>
108,クラピカ,話を聞け！！,听我说话！！
109,ゴン,あはは……,啊哈哈……
110,,クラピカはサラーサを止め、まずは\n該当の壁の破壊にも耐えられるよう\n遺跡を補強、保全することに決める。,酷拉皮卡阻止了萨拉萨，决定先\n对遗迹进行加固和保护，以确保\n它能承受住墙壁被破坏的冲击。
info,,,scene_evt250807_cp2_q3_s10
译者,,,Gemini