id,name,text,trans
0-chapter_name,,第4話 ガンサク×ノ×タンサク,第4话 赝作×与×探索
0-synopsis,,ゴンとキルアは、本物にだけ宿る人々の“想い”を「凝」を使うことで見抜き、商店から贋作を買い集めていた。集めた贋作を元に、クラピカが“<ruby>導く薬指の鎖<rt>ダウジングチェーン</rt></ruby>”を用いてアンドサの特別な贋作の在処を突き止める。そこへ、外出先から帰ってくるヒソカ。どうやら懸賞金が掛けられている伝説のカブトムシを採りに行っていたようで、一行は困惑の色を浮かべるのだった。,小杰和奇犽使用「凝」看穿了只寄宿在真品上的人们的“意念”，正在从商店里收购赝品。酷拉皮卡以收集到的赝品为基础，使用“<ruby>引导的无名指之链<rt>Dowsing Chain</rt></ruby>”找到了安德萨制作的特殊赝品的所在地。就在这时，西索从外面回来了。他似乎是去捕捉被悬赏的传说中的独角仙了，这让一行人露出了困惑的神色。
1,,ペラーゴの街の一角、\n商店が立ち並ぶエリアを、\nゴンとキルアは歩いていた。,在佩拉戈镇的一角，\n小杰和奇犽正走在\n商店林立的区域。
2,ゴン/小杰,…………,…………
4,,街の人間たちは気づかないが、\nふたりの目にはオーラが纏われている。,虽然街上的人们没有注意到，\n但两人的眼中正缠绕着气。
5,,“凝”と呼ばれる念の技術のひとつで、\n目にオーラを纏った場合は、普段は\n視認できない物を見ることができる。,这是一种被称为「凝」的念能力技术，\n当将气集中于眼部时，\n便能看到平时无法看见的东西。
6,ゴン/小杰,うーーん……,唔——嗯……
7,店主/店长,おお、坊ちゃん。良いものに目を\nつけましたね。これはかの有名な\n宝石職人が手作業で作った一品ですよ。,哦哦，小少爷。您可真有眼光啊。\n这可是那位有名的\n宝石工匠亲手制作的逸品哦。
8,キルア/奇犽,どうだ？　ゴン。,怎么样？小杰。
9,店主/店长,おやおや？　もしかして贋作を疑って\nいらっしゃる？　ご安心ください。\n鑑定書もしっかりとございまして──,哦呀哦呀？难道您是在怀疑\n这是赝品吗？请放心。\n我们这里也有好好的鉴定书——
10,ゴン/小杰,ダメだね。\nこれ、本物だよ。,不行呢。\n这个，是真品哦。
11,店主/店长,へ？,诶？
12,キルア/奇犽,なーんだ、本物かよ。\nオレたちが欲しいのは\n偽物の方だっつーのに。,什么啊，是真品啊。\n我们想要的\n可是赝品啊。
13,店主/店长,え……？　偽物が欲しいのですか？\nお客様、一体なぜ……？,诶……？您想要赝品吗？\n客人，这到底是为什么……？
14,,困惑する店主を他所にゴンとキルアは\nそのまま店先を観察し、やがて\nひとつの商品に目を止めた。,小杰和奇犽不理会困惑的店主，\n继续观察着店里的商品，\n不一会儿，目光停留在了一件商品上。
15,ゴン/小杰,あった！　偽物だよ、キルア！,找到了！是赝品哦，奇犽！
16,店主/店长,にせ！？　というか、\nなぜ偽物を嬉しそうに……！？,赝！？话说回来，\n为什么看到赝品会这么高兴……！？
17,キルア/奇犽,でかした！\nすいませーん、これくださーい！,干得好！\n不好意思——，请给我这个——！
18,店主/店长,お客様ーー！？\n正気なのですかーー！！？,客人——！？\n您是认真的吗——！！？
24,ビィ/碧,こっちが本物で……,这边的是真品……
25,ビィ/碧,こっちが偽物……\nううーん……,这边的是赝品……\n唔唔嗯……
26,ビィ/碧,ダメだぁ！　オイラにはまったく\n分かんねえよ！　ほんとに\nオーラってのが出てるのかよ？,不行啊！我完全\n看不出来啊！真的\n有叫作气的东西散发出来吗？
27,ゴン/小杰,うん。オレたち、前にも\n似たような目利きをした\nことがあるんだ。,嗯。我们以前也做过\n类似的鉴定。
28,キルア/奇犽,オレ達の世界では優れた職人によって\n作られた宝や多くの人の手を渡ってきた\nものにはオーラが宿ることがあるんだ。,在我们的世界里，由优秀工匠\n制作的宝物，或是经由许多人之手的\n物品，有时会寄宿着气。
29,ゴン/小杰,もしかして、と思ったら……\nオーラに近いものが見えたんだ！,我还在想会不会是呢……\n结果就看到了类似气的东西！
30,ゴン/小杰,きっと大事にしていた人や\n作った人の強い“想い”なんじゃ\nないかな……,那一定是珍惜它的人或是\n制作者强烈的“意念”\n之类的吧……
31,キルア/奇犽,けど、その“想い”は\nアンドサが作ったものには見えない。,但是，那个“意念”\n在安德萨做的东西上是看不到的。
32,ルリア/露莉亚,だから、同じ物がふたつあれば、\n“想い”が見えない方が偽物って\nことなんですね！　すごいです！,所以，如果同样的东西有两个的话，\n看不到“意念”的那个就是赝品，\n是这么回事吧！好厉害！
33,クラピカ/酷拉皮卡,この方法なら贋作は集められる……\n集めるための\n費用さえ考えなければだが……,用这个方法的话就能收集到赝品……\n前提是不考虑\n收集所需的费用……
34,荒くれ者１/小混混１,親分！　よ、要人警備の費用だけで\n贋作の回収は無理がありますよ！\nやっぱ、財宝を売っちまったほうが……,老大！光、光靠要人警备的费用\n来回收赝品是不可能的！\n果然还是把财宝卖掉比较……
35,クラピカ/酷拉皮卡,アンドサが作った偽物である可能性の\nあるものを市場に出すことはできない。\n多くの人が苦しむことになる。,不能把有可能是安德萨制作的赝品\n流入市场。\n那样会让很多人受苦的。
36,クラピカ/酷拉皮卡,いいか、本物と同じだから問題ない\nというわけではないんだ。君たちは\n欲に呑まれることを最も恐れるべきだ。,听好了，并不是说和真品一样就没问题了。\n你们最应该恐惧的是\n被欲望吞噬。
37,クラピカ/酷拉皮卡,アンドサの作った宝がやつの意思で\n消されない保証もない。そんなもので\n人心を混乱させるわけにはいかない。,也无法保证安德萨制作的宝物\n不会因他的意志而消失。不能用那种东西\n来扰乱人心。
38,荒くれ者１/小混混１,でも……自警団の予算、\nすでにかなり使いこんじゃって\nるんですけど……,可是……自警团的预算，\n已经用掉相当多了……
39,荒くれ者２/小混混２,このままじゃ俺たち破産っすよ……！\n借金地獄は嫌っす～……！,再这样下去我们就要破产了……！\n我可不想下借钱地狱啊～……！
40,クラピカ/酷拉皮卡,ぐ……も、もっともな意見だ。\nオーラで本物と分かっている物も\n保有している財宝にはあったな……,唔……也、也是很合理的意见。\n在我们持有的财宝中，\n也有用气辨别出是真品的东西……
41,クラピカ/酷拉皮卡,そちらを売って\nなんとかするしかあるまい……,看来也只能把那些卖掉\n来想办法了……
42,キルア/奇犽,値段交渉に自信はあんのか？\n値段吊り上げるのって\n結構ムズカシーぜ？,你有自信进行价格交涉吗？\n要把价格抬高\n可是相当难的哦？
43,ゴン/小杰,ははは……レオリオがいれば\n任せられたんだけどね……,哈哈哈……要是雷欧力在的话\n就能交给他了呢……
44,クラピカ/酷拉皮卡,ふっ……確かにあいつなら上手く\nやりそうだ。よもやレオリオの力を\n頼りたくなる時が来るとはな……,呵……确实，那家伙的话应该能做得很好。\n没想到居然会有想要\n依靠雷欧力的力量的时候啊……
50,クラピカ/酷拉皮卡,さて、それなりに\n贋作は集まったわけだが、\nヒソカは今どうしている？,好了，赝品也收集得\n差不多了，\n西索现在在做什么？
51,ゴン/小杰,え？　どうなんだろう？\n「アンドサのことを調べる」とは\n言ってたけど……,诶？怎么样了呢？\n他虽然说了要去「调查关于安德萨的事」\n……
52,キルア/奇犽,基本は艇にいるみたいだけど、\nふらふらとどっかに行っちまうんだよ。\n今回もそうだろうぜ。,他基本上好像都待在艇上，\n但会晃来晃去地不知道跑去哪儿。\n这次也一样吧。
53,クラピカ/酷拉皮卡,そうか。それはむしろ好都合だな。\nでは、今のうちに済ませてしまうか。,是吗。那反而正好。\n那么，就趁现在解决掉吧。
54,,クラピカはそう話すと、\n卓上に地図を広げ、右手の薬指から\n伸びた鎖をたれ下げた。,酷拉皮卡这么说着，\n在桌上摊开地图，从右手的无名指\n垂下了伸出的锁链。
55,ビィ/碧,鎖……？\nそれを何かに使うのか……？,锁链……？\n那是要用在什么地方吗……？
56,クラピカ/酷拉皮卡,ああ、これは私の念能力でね。\n見ているといい。,啊，这是我的念能力。\n你们看着就好。
59,クラピカ/酷拉皮卡,“<ruby>導く薬指の鎖<rt>ダウジングチェーン</rt></ruby>”,「<ruby>引导的无名指之链<rt>Dowsing Chain</rt></ruby>」
61,ビィ/碧,鎖の先が勝手に動き出した……！？,锁链的前端自己动起来了……！？
62,ルリア/露莉亚,エゼクレインさんの魔法に\n似ていますね。\nダウジング……でしょうか？,和艾泽克莱因先生的魔法\n很像呢。\n是探矿术……吗？
63,クラピカ/酷拉皮卡,分類するならそうなるな。\nもっとも、私も細かい仕組みを\n把握しているわけではないのだが……,要分类的话算是吧。\n不过，我自己也没掌握\n详细的原理……
64,クラピカ/酷拉皮卡,アンドサが作った贋作には、\nたとえそれが特別な物でなくとも、\n少なからずアンドサの力が籠っている。,安德萨制作的赝品，\n就算不是什么特别的东西，\n也或多或少地蕴含着安德萨的力量。
65,クラピカ/酷拉皮卡,この能力を使っている時の私は、\nその微弱な気配を感じ取る。\nこれだけの数の贋作があれば──,在使用这个能力的时候，\n我能感觉到那微弱的气息。\n只要有这么多赝品的话——
66,,鎖は地図上のとある箇所を\n指し示して停止していた。,锁链指向地图上的某个地方\n停了下来。
67,クラピカ/酷拉皮卡,それを頼りに、特別な贋作を\n探しあてることも可能、というわけだ。,也就是说，以此为线索，\n就有可能找到那件特殊的赝品了。
68,ルリア/露莉亚,すごいです！\n念能力ってこんなことも\nできるんですね！,好厉害！\n原来念能力连这种事\n都能做到啊！
69,キルア/奇犽,全員ができるわけじゃねーけどな。\nオレとゴンは戦闘に特化してるから。\nこういう補助的なのはできねーし。,也不是所有人都能做到啦。\n我和小杰都是特化战斗的。\n做不了这种辅助性的事。
71,クラピカ/酷拉皮卡,私は戦闘以外に、失せ物や人探しの\n能力が必要になったからな。能力の\n違いは環境の違いによるものだろう。,因为我在战斗之外，还需要寻找失物和寻人的\n能力。能力的不同\n大概是环境不同造成的吧。
72,クラピカ/酷拉皮卡,だが、搦め手に特化した能力というのは\n種が割れてしまうと対策が立てやすい。\nできるだけ情報が漏れる事は避けたい。,但是，特化于奇袭的能力一旦\n被看穿底细就很容易被制定对策。\n所以要尽量避免情报泄露。
73,ビィ/碧,いいのかよ？\nそんな大事にしてる能力を\nオイラたちに見せちまって？,这样好吗？\n把那么重要的能力\n展示给我们看？
74,クラピカ/酷拉皮卡,気にしないでくれ。君たちは私たちに\n誠意をもって応じてくれた。私も誠意の\n証として能力を明かしたまでだよ。,别在意。你们对我们\n也抱持着诚意。我也只是为了\n证明我的诚意才公开我的能力。
75,キルア/奇犽,けど、ヒソカ相手には伏せて\nおきたいってことだよな？,但是，你想对西索保密，\n是这个意思吧？
76,クラピカ/酷拉皮卡,そういうことになるな。\nヒソカと我々の関係は信用や信頼で\n成り立っているとは言えない。,可以这么说。\n西索和我们的关系，\n不能说是建立在信用和信赖之上的。
77,クラピカ/酷拉皮卡,おそらく、ヒソカの方も、我々に能力の\n全てを明かしてはいないだろう。ならば\nこちらから開示する義理もあるまい。,恐怕西索那边，也没有对我们\n全盘托出他的能力吧。既然如此，\n我方也没有率先公开的道理。
78,キルア/奇犽,あいつのことだ。\n急に寝首かいてきたりしかねないぜ。,毕竟是那家伙。\n说不定会突然趁人不备下杀手。
79,ゴン/小杰,ヒソカ、G.I.の時は\n助けてくれたけどね。,不过在G.I.的时候，\n西索也帮过我们。
80,クラピカ/酷拉皮卡,<span class='scene-font-4'>なに！？</span>\nやつと共闘していたのか？,<span class='scene-font-4'>什么！？</span>\n你和他并肩作战过？
81,ゴン/小杰,うん！　一緒にドッジボールで\nレイザーって人と戦ったんだ！,嗯！我们一起用躲避球\n和一个叫磊扎的人战斗过！
82,クラピカ/酷拉皮卡,ドッジボール……？\nヒソカがやったのか……？\nいったいどういう成り行きで……？,躲避球……？\n西索也参加了……？\n到底是怎么回事……？
83,キルア/奇犽,ゲーム内でそういう展開があってさ。\nアイツがいないと勝てなかったって\nくらいには貢献してたぜ？,是游戏里的一个环节。\n那家伙的贡献大到可以说\n没有他就赢不了哦？
84,クラピカ/酷拉皮卡,ヒソカがそんなことを……\nなんとも読めない男だな……,西索竟然会做那种事……\n真是个难以捉摸的男人……
85,ヒソカ/西索,ボクのコトを呼んだかい♦,是在叫我吗♦
86,ふたり/两人,…………！,…………！
87,ヒソカ/西索,財宝と地図……♠\nそれを使って何かしてたのかな？,财宝和地图……♠\n你们用那个做了什么吗？
88,クラピカ/酷拉皮卡,（念能力を使ったところは\n見られていない……だが、\nこうも間がいいと……）,（使用念能力的场面\n应该没被看到……但是，\n时机这么巧的话……）
89,キルア/奇犽,財宝があらかた集まってきたから、\n団員の魔法で、アンドサの居場所を\n探ってもらってたんだよ。,因为财宝差不多都收集齐了，\n所以就让团员用魔法\n帮忙找安德萨的所在地哦。
90,ヒソカ/西索,へえ……？\nそれは便利な魔法だね。\nこれで捜査に進展アリってことだね♥,哦……？\n那还真是方便的魔法呢。\n也就是说搜查有进展了是吧♥
91,キルア/奇犽,まあな。ってことで、オレたちは\nそっちの探索に移る予定だけど、\nヒソカは今までどこ行ってたんだ……？,算是吧。所以呢，我们\n正准备去那边探索，\n西索你刚才去哪儿了……？
92,ヒソカ/西索,ああ、ボク？\n贋作を買い集めるって聞いてたから、\n少しでも足しになればと思ってね……♦,啊啊，我吗？\n因为听说你们在收购赝品，\n想着能不能帮上一点忙……♦
93,,ヒソカはそう話すと、\n手に持っていた小さな箱状の物を\n一行に差し出す。,西索这么说着，\n把手上拿着的小箱子状的物体\n递给了一行人。
94,,虫かごのような手持ちサイズの\n小さな檻の中に入っていたのは\n宝石のように輝くカブトムシだった。,在那个像虫笼一样可以手提的\n小笼子里，装着一只\n像宝石一样闪闪发光的独角仙。
95,ゴン/小杰,へ……？\nカブトムシ……？,诶……？\n独角仙……？
96,ヒソカ/西索,普通の罠だと、気配を察知して逃げて\nしまうからね。“<ruby>伸縮自在の愛<rt>バンジーガム</rt></ruby>”で\n罠を張ってようやく捕まえられたんだ♥,用普通的陷阱，它会察觉到气息然后逃掉\n呢。我用「<ruby>伸缩自如的爱<rt>Bungee Gum</rt></ruby>」\n设下陷阱才总算抓到它♥
97,ビィ/碧,マジかよ……！\nルリア、姬塔……これ……！\n酒場の張り紙で見たやつだよな！？,真的假的……！\n露莉亚，姬塔……这个……！\n是在酒馆的悬赏令上看到的那个吧！？
98,ルリア/露莉亚,はい……！　間違いありません……！\n懸賞金がかかってた\n伝説のカブトムシです！,是的……！没错……！\n就是那个被悬赏的\n传说中的独角仙！
99,キルア/奇犽,それじゃ、ヒソカ……\n今まで森の中でカブトムシを\n追っかけ回してたってことかよ……？,这么说，西索……\n你刚才一直在森林里\n追着独角仙跑吗……？
100,ヒソカ/西索,なかなか楽しかったよ？\nクラピカも予算の足しになって\n助かっただろ？,还挺开心的哦？\n对酷拉皮卡来说也补充了预算，\n帮大忙了吧？
101,クラピカ/酷拉皮卡,そ、それはそうだな……\nありがとう……,那、那倒是……\n谢谢你……
102,ヒソカ/西索,いいよ、お互い様だろ？\nそれじゃ、目的地に着いたら\n呼んでくれ♣,没事，互相帮助嘛？\n那么，到了目的地就\n叫我吧♣
105,キルア/奇犽,読めねえやつ……,真是个搞不懂的家伙……
106,,檻を置いて、悠々と去っていく\nヒソカにゴンたちは困惑の色を\n隠せないのだった……,看着放下笼子，悠然离去的\n西索，小杰他们\n难掩困惑的神色……
info,,,scene_evt250812_cp4_q2_s10
译者,,,Gemini