id,name,text,trans
0-chapter_name,,オープニング,序章
0-synopsis,,ある街に住む少女・ミレイユは、病弱故に思い通りにならない自身の身体を憂えていた。友人を作ることも両親の仕事についていくこともできないミレイユがひとり寂しく家で過ごしていると、偶然にも錬金術にまつわる本を見つける。本には人体の錬成についてが記されており、ミレイユは自身の元気な身体を造るために独学で錬金術を学び始めるのだった。,住在某个城市的少女米雷耶，由于身体虚弱而对无法随心所欲的身体感到忧虑。不能交朋友，也不能跟随父母去工作，米雷耶独自一人寂寞地在家中度日，偶然间她发现了一本关于炼金术的书。书中记载了关于人体炼成的内容，米雷耶为了打造一个健康的身体，开始自学炼金术。
1,,とある街の片隅にある\nありふれた商人の家。,在某个城市的角落里，有一户普通商人的家。
2,,その一室に置かれたベッドの上では、\nひとりの少女が\n苦しげな表情を浮かべていた。,在那房间里的一张床上，一个少女面露痛苦之色。
3,少女,はぁ……はぁ……,哈……哈……
5,ミレイユの母親,はい、ミレイユ。\nお水を持ってきたわ。,好了，米雷耶。我带来了水。
7,ミレイユ/米雷耶,ありがとう……お母様。,谢谢……母亲。
8,ミレイユの母親,貴方、やっぱり今日は……,你，果然今天还是……
9,ミレイユの父親,いや、それはできない。\n今日の会合を逃したら\n次はないんだ。,不，那不行。如果错过今天的会合，就没有下次了。
10,ミレイユの母親,でも、こんな状態のミレイユを\n置いていくなんて……,可是，把米雷耶留在这样的状态下……
11,ミレイユ/米雷耶,お父様、お母様、\n今日もお仕事行っちゃうの……？,父亲，母亲，今天也要去工作吗……？
12,ミレイユの母親,ミレイユ……,米雷耶……
13,ミレイユの父親,……すまないミレイユ。\n今日の会合はとても\n大切なものなんだ。,……对不起，米雷耶。今天的会合非常重要。
14,ミレイユ/米雷耶,…………,…………
15,ミレイユの父親,発作で苦しんでいるお前を\n置いていくことは\n本当にすまないと思う。,把正在发作痛苦的你留在这里，我真的感到抱歉。
16,ミレイユの父親,でも、いい子のお前なら\nわかってくれるね？,但是，乖孩子的你会理解的，对吧？
17,ミレイユ/米雷耶,…………,…………
18,ミレイユ/米雷耶,……うん。,……嗯。
19,ミレイユの父親,いい子だ。\nこの埋め合わせは\n後で必ずするからな。,乖孩子。这次一定会补偿的。
20,ミレイユの母親,ええ。ミレイユのお願いを\nなんでも聞いてあげる。,是的。米雷耶的愿望我们都会听。
21,ミレイユ/米雷耶,ほんと……？　じゃ、じゃあ、\n今度、みんなで一緒に\nお外をお散歩したい……,真的吗……？那、那么，下次大家一起出去散步吧……
22,ミレイユの父親,ああ、いいぞ。\nでも、熱が下がってからだぞ？,嗯，可以啊。但要等你退烧后哦？
23,ミレイユの母親,そうね。\n貴女の熱が下がって\n体調が良くなった時にね。,是啊。等你退烧身体好转的时候。
24,ミレイユ/米雷耶,うん……わかった。\nだから、約束……,嗯……知道了。所以，约定……
25,ミレイユの母親,ええ、約束よ。,嗯，约定好了。
26,,母親はミレイユの弱々しい指に\n自分の指を絡めると\n指切りをする。,母亲将自己的手指缠绕在米雷耶虚弱的手指上，勾指为誓。
27,ミレイユの母親,できるだけ、\n早く帰るようにするからね……,会尽可能早点回来……
28,ミレイユの母親,後、お菓子も\nいっぱい買ってくるから。,还有，会买好多点心回来哦。
29,ミレイユ/米雷耶,うん……楽しみにしてるね。,嗯……很期待哦。
30,ミレイユの父親,それじゃ、私達は行ってくるよ。,那我们就出发了。
31,ミレイユ/米雷耶,あっ、まって……,啊，等一下……
32,ミレイユの母親,ミレイユ？,米雷耶？
33,ミレイユ/米雷耶,う、ううん、何でもない。\nいってらっしゃい……,不，不，没什么。路上小心……
34,,ミレイユが頷くのを確認すると\n両親は心配げな表情を浮かべながらも\n仕事へと出かけていく。,确认米雷耶点头后，父母略显担忧的表情中离开去工作。
36,ミレイユ/米雷耶,…………,…………
37,,静寂に満ちた室内で\nミレイユは小さく嗚咽を漏らす。,在充满寂静的房间里，米雷耶轻轻地抽泣。
38,ミレイユ/米雷耶,ぐすっ……,呜……
39,ミレイユ/米雷耶,やっぱり、ひとりは嫌……\n寂しいよ……\nおいていかな──,果然，一个人好讨厌……好寂寞……不要留下我──
40,ミレイユ/米雷耶,あぐっ……くうっ……\nげほっ……,啊呜……咳咳……
41,ミレイユ/米雷耶,はぁ……はぁ……,哈……哈……
42,ミレイユ/米雷耶,置いていかないで……\nなんて思ったから\nばちが当たったのかな……,因为想着不要留下我……所以遭报应了吗……
43,ミレイユ/米雷耶,私はいい子だから……\nだから、わがままを言ったら、\nダメ……だもんね。,我是乖孩子……所以，说任性的话是不行的……对吧。
44,ミレイユ/米雷耶,それにこの身体のせいでお父様達に\nめいわくをかけてばかりなんだし……,而且因为这身体总是给父母添麻烦……
45,ミレイユ/米雷耶,げほっげほっ……,咳咳咳……
46,男の子１/男孩１,あはは！\n見て見てー！,哈哈！看这里看这里！
47,女の子１/女孩１,ねぇ、パパ、ママー！\nこっちこっちー！,喂，爸爸，妈妈！这边这边！
48,,窓の外から聞こえてくる\n子供達のにぎやかな声。,从窗外传来孩子们热闹的声音。
50,,ミレイユはその声に誘われるように\n覚束ない足取りでベッドから出ると\n部屋の窓を開ける。,米雷耶被那声音吸引着，摇摇晃晃地从床上下来，打开了房间的窗户。
56,母親/母亲,もう、走ったら危ないわよ！,哎呀，跑起来很危险哦！
57,父親/父亲,はは、たまにはいいじゃないか。\n私達が傍にいるんだし。,哈哈，偶尔这样也不错。我们在旁边呢。
58,男の子１/男孩１,もう、おそいよー！\nはやくー！,已经很慢了哦！快点！
60,女の子１/女孩１,そうだよー！\nはやく来てー！,没错！快来！
67,,楽しそうに笑い合う\n子供とその両親。\n他愛ない団欒の一幕。,愉快地相互笑着的孩子和他们的父母。无忧无虑的团聚一幕。
68,,その光景にミレイユは\n羨望の眼差しを向ける。,米雷耶用羡慕的眼神看着这景象。
69,ミレイユ/米雷耶,いいな……\n私も……,真好啊……我也……
70,ミレイユ/米雷耶,げほっ、げほっげほっ！,咳，咳咳咳！
72,ミレイユ/米雷耶,はぁ……はぁ……\nどうして私だけ、\nこんな身体……なのかな。,哈……哈……为什么只有我，身体是这样的……
73,ミレイユ/米雷耶,どうして、私は\n元気になれない……のかな。,为什么，我不能变得健康……
74,ミレイユ/米雷耶,元気になれたら\n友達も沢山できるのに……,如果能健康，朋友也能交很多……
75,ミレイユ/米雷耶,お父様やお母様と一緒に\nお外で遊ぶことだって……,还可以和父亲母亲一起在外面玩……
76,ミレイユ/米雷耶,ううん、お父様達の仕入れにだって\n一緒について行けるのに……,不对，还可以跟随父亲们去进货……
77,ミレイユ/米雷耶,もっと一緒にいられるのに……,还能在一起更多……
78,,静かに頬を伝い溢れ出た涙は、\nぽたぽたと床を濡らす。,泪水悄然流过脸颊，滴滴答答地打湿地板。
79,,ひとりきりの部屋で\nミレイユの嗚咽だけが静かに響く。,在独自一人的房间里，只有米雷耶的呜咽静静回响。
81,ミレイユ/米雷耶,（もうベッドに戻ろう……\nこれ以上、風にあたったら、\nもっと体調が悪く──）,（还是回到床上吧……再这样吹风，身体会更糟糕──）
82,ミレイユ/米雷耶,げほっげほっ……！,咳咳……
84,,強く咳き込んだ拍子に\n体勢を崩したミレイユは\n積まれていた本の山を崩してしまう。,因剧烈咳嗽而失去平衡的米雷耶，不小心推倒了一堆书籍。
85,ミレイユ/米雷耶,あ……な、直さなきゃ……\nお父様達にこれ以上めいわくは……,啊……得、得整理好……不能再给父母添麻烦……
86,,覚束ない足取りで本を拾うミレイユは\nふと、落ちた拍子に開いてしまった\n本の１ページに目を留める。,步履蹒跚地捡起书籍的米雷耶，偶然间目光停留在掉落时打开的一页。
87,ミレイユ/米雷耶,<span class='scene-font-spword'>「人体の錬成」</span>……\n造れるの？　身体を……？,「人体炼成」……可以造吗？身体……
88,,天啓を得たように\nミレイユはその本を手に取り、\n表紙とタイトルを確認する。,如同获得启示般，米雷耶拿起那本书，确认封面和标题。
89,ミレイユ/米雷耶,『先端錬金術の実践的諸原理』……\n魔法のお勉強の本……かな？,『先进炼金术的实用诸原理』……是魔法学习的书……吗？
90,,ミレイユは再び先ほどのページを開き、\nその内容を読み進めていく。,米雷耶再次打开刚才的那一页，继续阅读其中内容。
96,,そして、ページを読み進める度に\nミレイユの瞳に\n小さな炎が宿り始める。,随着阅读的深入，米雷耶的眼中开始燃起一丝小小的火焰。
97,ミレイユ/米雷耶,人体の錬成、素体の作成……\n人の身体を造る錬金術……,人体炼成，素体的制作……造人身体的炼金术……
98,ミレイユ/米雷耶,これを使えるようになれば、\n私は元気な身体を手に入れられる……,如果能掌握这个，我就能得到健康的身体……
99,,これが少女と錬金術の出会い。,这是少女与炼金术的相遇。
100,,そして、これを機に少女は\n独学で錬金術を学び始める。,于是，以此为契机，少女开始自学炼金术。
101,,元気な身体が欲しい。\nその願いを実現させるために……,想要一个健康的身体。为了实现这个愿望……
info,,,scene_evt201028_cp0_q1_s10
译者,,,gpt-4o-latest